product,brand,price,oz_per_can,num_cans,price_per_oz,ingredients
Purina Pro Plan Chicken  Pasta & Spinach Entree in Gravy Canned Cat Food,Purina Pro Plan,$23.28,3.0,24.0,0.32333333333333336,"['Water Sufficient for Processing', ' Chicken', ' Wheat Gluten', ' Liver', ' Meat By-Products', ' Pasta (Wheat Flour', ' Egg Whites)', ' Spinach', ' Turkey', ' Corn Starch-Modified', ' Artificial and Natural Flavors', ' Salt', ' Calcium Phosphate', ' Soy Protein Concentrate', ' Potassium Chloride', ' Added Color', ' Taurine', ' Choline Chloride', ' Vitamin E Supplement', ' Thiamine Mononitrate', ' Zinc Sulfate', ' Ferrous Sulfate', ' Niacin', ' Calcium Pantothenate', ' Vitamin A Supplement', ' Menadione Sodium Bisulfite Complex (Source of Vitamin K Activity)', ' Copper Sulfate', ' Manganese Sulfate', ' Pyridoxine Hydrochloride', ' Riboflavin Supplement', ' Vitamin B-12 Supplement', ' Biotin', ' Folic Acid', ' Vitamin D-3 Supplement', ' Potassium Iodide.']"
Tiny Tiger Chunks in EXTRA Gravy Chicken Recipe Grain-Free Canned Cat Food,Tiny Tiger,$12.99,3.0,24.0,0.18041666666666667,"['Chicken Broth', ' Chicken', ' Liver', ' Turkey', ' Meat By-Products', ' Potato Starch', ' Dried Egg Product', ' Natural Flavor', ' Salt', ' Guar Gum', ' Sodium Phosphate', ' Potassium Chloride', ' Tricalcium Phosphate', ' Vitamins (Vitamin E Supplement', ' Thiamine Mononitrate', ' Niacin Supplement', ' D-Calcium Pantothenate', ' Pyridoxine Hydrochloride', ' Riboflavin Supplement', ' Vitamin A Supplement', ' Biotin', ' Vitamin D3 Supplement', ' Vitamin B12 Supplement', ' Folic Acid)', ' Choline Chloride', ' Calcium Carbonate', ' Minerals (Ferrous Sulfate', ' Zinc Oxide', ' Copper Proteinate', ' Sodium Selenite', ' Manganese Sulfate', ' Potassium Iodide)', ' Dl-Methionine', ' Taurine', ' Magnesium Sulfate', ' Fish Oil (Preserved With Mixed Tocopherols).']"
Earthborn Holistic Catalina Catch Grain-Free Natural Canned Cat & Kitten Food,Earthborn Holistic,$38.16,5.5,24.0,0.28909090909090907,"['Mackerel', ' Fish Broth', ' Shrimp', ' Sunflower Oil', ' Natural Flavors', ' Tricalcium Phosphate', ' Guar Gum', ' Salt', ' Choline Chloride', ' Potassium Chloride', ' Taurine', ' Zinc Oxide', ' Iron Proteinate', ' Niacin', ' Vitamin E Supplement', ' Sodium Selenite', ' Manganese Sulfate', ' Thiamine Mononitrate', ' Vitamin B12 Supplement', ' Copper Proteinate', ' Vitamin A Supplement', ' Calcium Pantothenate', ' Riboflavin Supplement', ' Pyridoxine Hydrochloride', ' Biotin', ' Vitamin D3 Supplement', ' Potassium Iodide', ' Folic Acid', ' Menadione Sodium Bisulfite Complex (Source of Vitamin K).']"
Sheba Perfect Portions Grain-Free Gourmet Chicken & Tuna Entree Cat Food Trays,Sheba,$19.20,2.6,24.0,0.30769230769230765,"['Chicken', ' Chicken Broth', ' Meat By-Products', ' Chicken Liver', ' Poultry By-Products', ' Tuna', ' Natural Flavor', ' Minerals (Potassium Chloride', ' Magnesium Sulfate', ' Calcium Carbonate', ' Zinc Sulfate', ' Iron Sulfate', ' Manganese Sulfate', ' Potassium Iodide', ' Copper Sulfate)', ' Guar Gum', ' Added Color', ' Sodium Tripolyphosphate', ' Fish Oil (Preserved with Mixed Tocopherols)', ' Vitamins (Choline Chloride', ' Thiamine Mononitrate [Vitamin B1]', ' Vitamin E Supplement', ' Pyridoxine Hydrochloride [Vitamin B6]', ' Vitamin D3 Supplement', ' Folic Acid', ' Menadione Sodium Bisulfite Complex [Source of Vitamin K Activity])', ' Dl-Methionine', ' Salt', ' Taurine.']"
Fussie Cat Premium Tuna with Shrimp Formula in Aspic Grain-Free Canned Cat Food,Fussie Cat,$33.36,82.0,24.0,0.016951219512195123,"['Tuna', ' Water Sufficient for Processing', ' Shrimp', ' Sunflower Seed Oil', ' Tricalcium Phosphate', ' Locust Bean Gum', ' Carrageenan', ' Guar Gum', ' Potassium Chloride', ' Choline Chloride', ' Fructooligosaccharide', ' Taurine', ' Zinc Sulfate', ' Vitamin E Supplement', ' Ferrous Sulfate', ' Thiamine Mononitrate (Source of Vitamin B1)', ' Nicotinic Acid (Source of Vitamin B3)', ' Calcium Pantothenate', ' Vitamin A Supplement', ' Potassium Iodide', ' Manganese Sulfate', ' Copper Sulfate', ' Vitamin D3 Supplement', ' Riboflavin Supplement (Source of Vitamin B2)', ' Pyridoxine Hydrochloride (Source of Vitamin B6)', ' Folic Acid', ' Menadione Sodium Bisulfite Complex', ' Vitamin B12 Supplement.']"
Wellness Natural Grain Free Gravies Tuna Dinner Canned Cat Food,Wellness,$14.76,3.0,12.0,0.41,"['Fish Broth', ' Chicken', ' Tuna', ' Chicken Liver', ' Dried Egg Whites', ' Dried Ground Peas', ' Natural Flavor', ' Carrots', ' Guar Gum', ' Sodium Phosphate', ' Ground Flaxseed', ' Salt', ' Calcium Carbonate', ' Potassium Chloride', ' Taurine', ' Choline Chloride', ' Cranberries', ' Minerals (Iron Amino Acid Chelate', ' Zinc Amino Acid Chelate', ' Copper Amino Acid Chelate', ' Manganese Amino Acid Chelate', ' Sodium Selenite', ' Potassium Iodide)', ' Vitamins (Thiamine Mononitrate', ' Vitamin E Supplement', ' Niacin', ' d-Calcium Pantothenate', ' Pyridoxine Hydrochloride', ' Riboflavin Supplement', ' Vitamin A Supplement', ' Biotin', ' Vitamin D3 Supplement', ' Vitamin B12 Supplement', ' Folic Acid).']"
Wellness CORE Signature Selects Shredded Boneless Chicken & Chicken Liver Entree in Sauce Grain-Free Canned Cat Food,Wellness,$31.80,5.3,12.0,0.5000000000000001,"['Boneless Chicken', ' Chicken Broth', ' Water Sufficient for Processing', ' Tapioca Starch', ' Potato Starch', ' Chicken Liver', ' Eggs', ' Natural Flavor', ' Salt', ' Sunflower Oil', ' Tricalcium Phosphate', ' Taurine', ' Magnesium Sulfate', ' Guar Gum', ' Vitamins [Vitamin E Supplement', ' Thiamine Hydrochloride', ' Niacin', ' Vitamin A Supplement', ' Pyridoxine Hydrochloride', ' d-Calcium Pantothenate', ' Riboflavin Supplement', ' Folic Acid', ' Vitamin D3 Supplement', ' Biotin', ' Vitamin B12 Supplement]', ' Potassium Chloride', ' Choline Chloride', ' Minerals [Zinc Amino Acid Chelate', ' Iron Amino Acid Chelate', ' Manganese Amino Acid Chelate', ' Copper Amino Acid Chelate', ' Potassium Iodide', ' Sodium Selenite].']"
Friskies Extra Gravy Chunky With Turkey in Savory Gravy Canned Cat Food,Friskies,$12.00,3.5,12.0,0.2857142857142857,"['Water', ' Turkey', ' Liver', ' Meat By-Products', ' Wheat Gluten', ' Chicken', ' Soy Flour', ' Corn Starch-Modified', ' Artificial And Natural Flavors', ' Added Color', ' Tricalcium Phosphate', ' MINERALS [Potassium Chloride', ' Mono And Dicalcium Phosphate', ' Zinc Sulfate', ' Ferrous Sulfate', ' Copper Sulfate', ' Manganese Sulfate', ' Potassium Iodide]', ' Taurine', ' Choline Chloride', ' Salt', ' VITAMINS [Thiamine Mononitrate (Vitamin B-1)', ' Vitamin E Supplement', ' Niacin (Vitamin B-3)', ' Calcium Pantothenate (Vitamin B-5)', ' Vitamin A Supplement', ' Menadione Sodium Bisulfite Complex (Vitamin K)', ' Pyridoxine Hydrochloride (Vitamin B-6)', ' Riboflavin Supplement (Vitamin B-2)', ' Vitamin B-12 Supplement', ' Biotin (Vitamin B-7)', ' Folic Acid (Vitamin B-9)', ' Vitamin D-3 Supplement]. B626818.']"
Friskies Indoor Classic Pate Salmon Dinner Canned Cat Food,Friskies,$12.54,5.5,24.0,0.09499999999999999,"['Water Sufficient for Processing', ' Salmon', ' Meat By-Products', ' Liver', ' Chicken', ' Rice', ' Powdered Cellulose', ' Spinach', ' Rice Flour', ' Artificial and Natural Flavors', ' Tricalcium Phosphate', ' Guar Gum', ' Parsley', ' Potassium Chloride', ' Added Color', ' Carrageenan', ' Salt', ' Taurine', ' DL-Methionine', ' Choline Chloride', ' Thiamine Mononitrate', ' Zinc Sulfate', ' Ferrous Sulfate', ' Vitamin E Supplement', ' Niacin', ' Copper Sulfate', ' Manganese Sulfate', ' Calcium Pantothenate', ' Vitamin A Supplement', ' Menadione Sodium Bisulfite Complex (Vitamin K)', ' Pyridoxine Hydrochloride', ' Riboflavin Supplement', ' Vitamin B-12 Supplement', ' Biotin', ' Folic Acid', ' Vitamin D-3 Supplement', ' Potassium Iodide. H-6085.']"
Royal Canin Veterinary Diet Selected Protein Adult PD in Gel Canned Cat Food,Royal Canin Veterinary Diet,$71.24,5.9,24.0,0.5031073446327683,"['Water Sufficient for Processing', ' Duck', ' Duck Liver', ' Pea Flour', ' Duck By-Product Meal', ' Pea Protein', ' Vegetable Oil', ' Carrageenan', ' Fish Oil', ' Carob Bean Gum', ' Calcium Sulfate', ' Natural Flavors', ' Taurine', ' Dl-Methionine', ' Choline Chloride', ' Cysteine', ' Potassium Chloride', ' Glycine', ' Vitamins [L-Ascorbyl-2-Polyphosphate (Source of Vitamin C)', ' Niacin Supplement', ' Dl-Alpha Tocopherol Acetate (Source of Vitamin E)', ' Thiamine Mononitrate (Vitamin B1)', ' Biotin', ' D-Calcium Pantothenate', ' Riboflavin Supplement', ' Pyridoxine Hydrochloride (Vitamin B6)', ' Vitamin B12 Supplement', ' Folic Acid', ' Vitamin D3 Supplement]', ' Trace Minerals [Zinc Proteinate', ' Zinc Oxide', ' Ferrous Sulfate', ' Copper Sulfate', ' Manganous Oxide', ' Sodium Selenite', ' Calcium Iodate]', ' Marigold Extract (Tagetes Erecta L.).']"
Fancy Feast Elegant Medleys Turkey Florentine Canned Cat Food,Fancy Feast,$16.51,3.0,24.0,0.22930555555555557,"['Poultry Broth', ' Turkey', ' Wheat Gluten', ' Liver', ' Meat By-Products', ' Spinach', ' Corn Starch-Modified', ' Artificial and Natural Flavors', ' Salt', ' Added Color', ' Tricalcium Phosphate', ' Soy Protein Concentrate', ' Potassium Chloride', ' Taurine', ' Choline Chloride', ' Magnesium Sulfate', ' Thiamine Mononitrate', ' Vitamin E Supplement', ' Zinc Sulfate', ' Ferrous Sulfate', ' Niacin', ' Calcium Pantothenate', ' Vitamin A Supplement', ' Menadione Sodium Bisulfite Complex (Source of Vitamin K Activity)', ' Copper Sulfate', ' Manganese Sulfate', ' Pyridoxine Hydrochloride', ' Riboflavin Supplement', ' Vitamin B-12 Supplement', ' Biotin', ' Folic Acid', ' Vitamin D-3 Supplement', ' Potassium Iodide. B-6703.']"
Fancy Feast Delights with Cheddar Grilled Turkey & Cheddar Cheese Feast in Gravy Canned Cat Food,Fancy Feast,$14.97,3.0,24.0,0.20791666666666667,"['Poultry Broth', ' Turkey', ' Liver', ' Wheat Gluten', ' Meat By-Products', ' Corn Starch-Modified', ' Cheese (Source of Cheddar Cheese)', ' Artificial and Natural Flavors', ' Salt', ' Sodium Caseinate', ' Calcium Phosphate', ' Soy Protein Concentrate', ' Soybean Oil', ' Added Color', ' Potassium Chloride', ' Dried Whey', ' Taurine', ' Sodium Tripolyphosphate', ' Magnesium Sulfate', ' Choline Chloride', ' Thiamine Mononitrate', ' Vitamin E Supplement', ' Zinc Sulfate', ' Niacin', ' Sorbic Acid (a Preservative)', ' Ferrous Sulfate', ' Calcium Pantothenate', ' Vitamin A Supplement', ' Menadione Sodium Bisulfite Complex (Source of Vitamin K Activity)', ' Pyridoxine Hydrochloride', ' Copper Sulfate', ' Manganese Sulfate', ' Riboflavin Supplement', ' Vitamin B-12 Supplement', ' Biotin', ' Folic Acid', ' Vitamin D-3 Supplement', ' Potassium Iodide.']"
Purina Pro Plan Focus Adult Weight Management Ground Turkey & Rice Entree Canned Cat Food,Purina Pro Plan,$23.28,3.0,24.0,0.32333333333333336,"['Water Sufficient for Processing', ' Turkey', ' Liver', ' Wheat Gluten', ' Meat By-Products', ' Rice', ' Soy Flour', ' Soy Protein Concentrate', ' Artificial and Natural Flavors', ' Potassium Chloride', ' Calcium Phosphate', ' Guar Gum', ' Taurine', ' Locust Bean Gum', ' Xanthan Gum', ' Carrageenan', ' Salt', ' Choline Chloride', ' Vitamin E Supplement', ' Thiamine Mononitrate', ' Zinc Sulfate', ' Ferrous Sulfate', ' Niacin', ' Calcium Pantothenate', ' Vitamin A Supplement', ' Menadione Sodium Bisulfite Complex (Source of Vitamin K Activity)', ' Copper Sulfate', ' Manganese Sulfate', ' Pyridoxine Hydrochloride', ' Riboflavin Supplement', ' Vitamin B-12 Supplement', ' Biotin', ' Folic Acid', ' Vitamin D-3 Supplement', ' Potassium Iodide.']"
BFF OMG Tuna & Chicken Charm Me Dinner in Gravy Wet Cat Food Pouches,BFF,$13.49,3.0,12.0,0.37472222222222223,"['Tuna Broth', ' Tuna', ' Chicken', ' Tapioca Starch', ' Sunflower Oil', ' Guar Gum', ' Calcium Sulfate', ' Tricalcium Phosphate', ' Potassium Chloride', ' Celery Powder', ' Salt', ' Vitamin E Supplement', ' Ferrous Sulfate', ' Niacin Supplement', ' Zinc Oxide', ' Thiamine Mononitrate (Vitamin B1)', ' Taurine', ' Vitamin A Supplement', ' Vitamin B12 Supplement', ' Vitamin D3 Supplement', ' Manganese Sulfate', ' Calcium Pantothenate', ' Riboflavin Supplement (Vitamin B2)', ' Pyridoxine Hydrochloride (Vitamin B6)', ' Biotin', ' Copper Amino Acid Complex', ' Sodium Selenite', ' Folic Acid', ' Menadione Sodium Bisulfite Complex (Source of Vitamin K3)', ' Potassium Iodide.']"
American Journey Pate Turkey & Salmon Recipe Grain-Free Canned Cat Food,American Journey,$18.89,2.5,12.0,0.6296666666666667,"['Turkey', ' Turkey Broth', ' Turkey Liver', ' Salmon', ' Natural Flavor', ' Flaxseed', ' Guar Gum', ' Taurine', ' Potassium Chloride', ' Salt', ' Cassia Gum', ' Xanthan Gum', ' Cranberries', ' Blueberries', ' Choline Chloride', ' Inulin', ' Magnesium Sulfate', ' Iron Proteinate', ' Zinc Proteinate', ' Fish Oil (Preserved with Mixed Tocopherols)', ' Thiamine Mononitrate', ' Sunflower Oil', ' Vitamin E Supplement', ' Copper Proteinate', ' Manganese Proteinate', ' Sodium Selenite', ' Niacin Supplement', ' d-Calcium Pantothenate', ' Pyridoxine Hydrochloride', ' Riboflavin Supplement', ' Vitamin A Supplement', ' Biotin', ' Potassium Iodide', ' Vitamin D3 Supplement', ' Vitamin B12 Supplement', ' Folic Acid', ' Rosemary Extract.']"
Purina Beyond Grain-Free Tuna  Mackerel & Carrot Recipe in Gravy Canned Cat Food,Purina Beyond,$11.45,3.0,12.0,0.31805555555555554,"['Fish Broth', ' Tuna', ' Chicken', ' Liver', ' Dried Egg Product', ' Potato Starch', ' Mackerel', ' Carrots', ' Natural Flavor', ' Guar Gum', ' Sodium Phosphate', ' Tricalcium Phosphate', ' Potassium Chloride', ' Salt', ' Taurine', ' Choline Chloride', ' Thiamine Mononitrate', ' Ferrous Sulfate', ' Vitamin E Supplement', ' Zinc Oxide', ' Copper Proteinate', ' Potassium Iodide', ' Niacin Supplement', ' Manganese Supplement', ' Calcium Pantothenate', ' Pyridoxine Hydrochloride', ' Riboflavin Supplement', ' Vitamin A Supplement', ' Biotin', ' Sodium Selenite', ' Vitamin D-3 Supplement', ' Vitamin B-12 Supplement', ' Folic Acid.']"
Weruva Cats in the Kitchen Love Me Tender Chicken & Duck Recipe Grain-Free Cat Food Pouches,Weruva,$16.99,3.0,12.0,0.4719444444444444,"['Water Sufficient For Processing', ' Chicken (Boneless', ' Skinless Breast)', ' Tuna', ' Duck', ' Tapioca Starch', ' Sunflower Seed Oil', ' Calcium Lactate', ' Tricalcium Phosphate', ' Xanthan Gum', ' Choline Chloride', ' Taurine', ' Zinc Sulfate', ' Vitamin E Supplement', ' Nicotinic Acid (Vitamin B3)', ' Ferrous Sulfate', ' Thiamine Mononitrate (Vitamin B1)', ' Calcium Pantothenate', ' Vitamin A Supplement', ' Manganese Sulfate', ' Riboflavin Supplement (Vitamin B2)', ' Pyridoxine Hydrochloride (Vitamin B6)', ' Vitamin D3 Supplement', ' Copper Sulfate', ' Folic Acid', ' Potassium Iodide', ' Biotin', ' Vitamin B12 Supplement.']"
Hill's Prescription Diet Metabolic + Urinary Chicken & Vegetable Stew Canned Cat Food,Hill's Prescription Diet,$42.89,2.9,24.0,0.6162356321839081,"['Water', ' Pork Liver', ' Carrots', ' Powdered Cellulose', ' Tuna', ' Chicken', ' Corn Starch', ' Wheat Gluten', ' Egg Whites', ' Dried Tomato Pomace', ' Rice', ' Chicken Liver Flavor', ' Flaxseed', ' Soybean Oil', ' Coconut Oil', ' Potassium Alginate', ' Fish Oil', ' Calcium Chloride', ' Dicalcium Phosphate', ' Guar Gum', ' Choline Chloride', ' Calcium Sulfate', ' L-Lysine', ' Monosodium Phosphate', ' Taurine', ' vitamins (Vitamin E Supplement', ' Thiamine Mononitrate', ' Niacin Supplement', ' Pyridoxine Hydrochloride', ' Calcium Pantothenate', ' Vitamin B12 Supplement', ' Riboflavin Supplement', ' Biotin', ' Vitamin D3 Supplement', ' Folic Acid)', ' Potassium Citrate', ' Sodium Tripolyphosphate', ' L-Carnitine', ' minerals (Zinc Oxide', ' Ferrous Sulfate', ' Manganese Sulfate', ' Copper Sulfate', ' Calcium Iodate)', ' Calcium Carbonate.']"
Friskies Gravy Sensations Poultry Favorites Cat Food Pouches,Friskies,$6.12,3.0,12.0,0.17,"['With Chicken In Gravy: Water Sufficient For Processing', ' Chicken', ' Liver', ' Wheat Gluten', ' Meat By-Products', ' Turkey', ' Corn Starch-Modified', ' Artificial And Natural Flavors', ' Soy Flour', ' Soy Protein Concentrate', ' Tricalcium Phosphate', ' Potassium Chloride', ' Taurine', ' Choline Chloride', ' Added Color', ' Salt', ' Thiamine Mononitrate', ' Vitamin E Supplement', ' Zinc Sulfate', ' Ferrous Sulfate', ' Niacin', ' Calcium Pantothenate', ' Vitamin A Supplement', ' Menadione Sodium Bisulfite Complex (Vitamin K)', ' Manganese Sulfate', ' Pyridoxine Hydrochloride', ' Copper Sulfate', ' Riboflavin Supplement', ' Vitamin B-12 Supplement', ' Biotin', ' Folic Acid', ' Vitamin D-3 Supplement', ' Potassium Iodide.']"
Weruva Cats in the Kitchen Mack  Jack & Sam Salmon  Mackerel & Tuna Recipe Grain-Free Cat Food Pouches,Weruva,$16.99,3.0,12.0,0.4719444444444444,"['Water Sufficient For Processing', ' Salmon', ' Mackerel', ' Tuna', ' Tapioca Starch', ' Sunflower Seed Oil', ' Calcium Lactate', ' Xanthan Gum', ' Tricalcium Phosphate', ' Choline Chloride', ' Taurine', ' Zinc Sulfate', ' Vitamin E Supplement', ' Nicotinic Acid (Vitamin B3)', ' Thiamine Mononitrate (Vitamin B1)', ' Calcium Pantothenate', ' Vitamin A Supplement', ' Manganese Sulfate', ' Ferrous Sulfate', ' Riboflavin Supplement (Vitamin B2)', ' Pyridoxine Hydrochloride (Vitamin B6)', ' Copper Sulfate', ' Folic Acid', ' Vitamin D3 Supplement', ' Potassium Iodide', ' Menadione Sodium Bisulfite Complex (Source of Vitamin K)', ' Biotin', ' Vitamin B12 Supplement.']"
Wellness CORE Signature Selects Shredded Boneless Chicken & Turkey Entree in Sauce Grain-Free Canned Cat Food,Wellness,$31.80,5.3,12.0,0.5000000000000001,"['Boneless Chicken', ' Chicken Broth', ' Water Sufficient for Processing', ' Tapioca Starch', ' Potato Starch', ' Chicken Liver', ' Eggs', ' Turkey', ' Natural Flavor', ' Salt', ' Sunflower Oil', ' Tricalcium Phosphate', ' Taurine', ' Magnesium Sulfate', ' Guar Gum', ' Vitamins [Vitamin E Supplement', ' Thiamine Hydrochloride', ' Niacin', ' Vitamin A Supplement', ' Pyridoxine Hydrochloride', ' d-Calcium Pantothenate', ' Riboflavin Supplement', ' Folic Acid', ' Vitamin D3 Supplement', ' Biotin', ' Vitamin B12 Supplement]', ' Potassium Chloride', ' Choline Chloride', ' Minerals [Zinc Amino Acid Chelate', ' Iron Amino Acid Chelate', ' Manganese Amino Acid Chelate', ' Copper Amino Acid Chelate', ' Potassium Iodide', ' Sodium Selenite].']"
Friskies Indoor Chunky Chicken & Turkey Casserole Canned Cat Food,Friskies,$13.68,5.5,24.0,0.10363636363636364,"['Water Sufficient for Processing', ' Chicken', ' Wheat Gluten', ' Meat By-Products', ' Liver', ' Rice', ' Powdered Cellulose', ' Corn Starch-Modified', ' Turkey', ' Spinach', ' Artificial and Natural Flavors', ' Soy Flour', ' Tricalcium Phosphate', ' Potassium Chloride', ' Added Color', ' Taurine', ' Choline Chloride', ' Salt', ' Thiamine Mononitrate', ' Vitamin E Supplement', ' Zinc Sulfate', ' Ferrous Sulfate', ' Niacin', ' Calcium Pantothenate', ' Vitamin A Supplement', ' Menadione Sodium Bisulfite Complex (Vitamin K)', ' Copper Sulfate', ' Manganese Sulfate', ' Xanthan Gum', ' Pyridoxine Hydrochloride', ' Riboflavin Supplement', ' Vitamin B-12 Supplement', ' Biotin', ' Folic Acid', ' Vitamin D-3 Supplement', ' Potassium Iodide. G-6081.']"
Purina Pro Plan Veterinary Diets EN Gastroenteric Formula Canned Cat Food,Purina Pro Plan Veterinary Diets,$47.99,5.5,24.0,0.3635606060606061,"['Meat By-Products', ' Water Sufficient For Processing', ' Liver', ' Rice', ' Chicken Hearts', ' Soy Protein Isolate', ' Turkey', ' Oat Hulls', ' Calcium Gluconate', ' Artificial And Natural Flavors', ' Fish Oil', ' Inulin', ' Guar Gum', ' Tricalcium Phosphate', ' Potassium Chloride', ' Taurine', ' Salt', ' Magnesium Sulfate', ' Mono And Dicalcium Phosphate', ' Vitamin E Supplement', ' Carrageenan', ' Zinc Sulfate', ' Ferrous Sulfate', ' Thiamine Mononitrate (Vitamin B-1)', ' Niacin (Vitamin B-3)', ' Copper Sulfate', ' Manganese Sulfate', ' Calcium Pantothenate (Vitamin B-5)', ' Vitamin A Supplement', ' Menadione Sodium Bisulfite Complex (Vitamin K)', ' Pyridoxine Hydrochloride (Vitamin B-6)', ' Riboflavin Supplement (Vitamin B-2)', ' Vitamin B-12 Supplement', ' Biotin (Vitamin B-7)', ' Folic Acid (Vitamin B-9)', ' Potassium Iodide', ' Vitamin D-3 Supplement.']"
Fancy Feast Creamy Delights Salmon Feast Canned Cat Food,Fancy Feast,$12.47,3.0,24.0,0.17319444444444446,"['Salmon', ' Liver', ' Meat By-Products', ' Fish Broth', ' Fish', ' Turkey', ' Milk', ' Artificial and Natural Flavors', ' Tricalcium Phosphate', ' Added Color', ' Guar Gum', ' Potassium Chloride', ' Salt', ' Taurine', ' Magnesium Sulfate', ' Mono and Dicalcium Phosphate', ' Red 3', ' Thiamine Mononitrate', ' Vitamin E Supplement', ' Zinc Sulfate', ' Ferrous Sulfate', ' Niacin', ' Calcium Pantothenate', ' Copper Sulfate', ' Vitamin A Supplement', ' Manganese Sulfate', ' Menadione Sodium Bisulfite Complex (Vitamin K)', ' Pyridoxine Hydrochloride', ' Riboflavin Supplement', ' Vitamin B-12 Supplement', ' Biotin', ' Folic Acid', ' Vitamin D-3 Supplement', ' Potassium Iodide. A-7038.']"
Wellness Complete Health Chicken & Herring Formula Grain-Free Canned Cat Food,Wellness,$37.56,2.5,12.0,1.252,"['Chicken', ' Chicken Liver', ' Whitefish', ' Chicken Broth', ' Herring', ' Carrots', ' Natural Flavor', ' Guar Gum', ' Cranberries', ' Ground Flaxseed', ' Potassium Chloride', ' Taurine', ' Salt', ' Cassia Gum', ' Xanthan Gum', ' Choline Chloride', ' Iron Proteinate', ' Zinc Proteinate', ' Thiamine Mononitrate', ' Beta-Carotene', ' Vitamin E Supplement', ' Copper Proteinate', ' Manganese Proteinate', ' Sodium Selenite', ' Niacin', ' d-Calcium Pantothenate', ' Pyridoxine Hydrochloride', ' Riboflavin Supplement', ' Vitamin A Supplement', ' Biotin', ' Potassium Iodide', ' Vitamin D3 Supplement', ' Vitamin B12 Supplement', ' Folic Acid.']"
Weruva Cats in the Kitchen Pumpkin Jack Splash Tuna in Pumpkin Soup Grain-Free Cat Food Pouches,Weruva,$16.99,3.0,12.0,0.4719444444444444,"['Water Sufficient For Processing', ' Tuna', ' Pumpkin', ' Tapioca Starch', ' Sunflower Seed Oil', ' Calcium Lactate', ' Tricalcium Phosphate', ' Xanthan Gum', ' Choline Chloride', ' Taurine', ' Zinc Sulfate', ' Vitamin E Supplement', ' Thiamine Mononitrate (Vitamin B1)', ' Nicotinic Acid (Vitamin B3)', ' Calcium Pantothenate', ' Manganese Sulfate', ' Vitamin A Supplement', ' Ferrous Sulfate', ' Riboflavin Supplement (Vitamin B2)', ' Pyridoxine Hydrochloride (Vitamin B6)', ' Vitamin D3 Supplement', ' Copper Sulfate', ' Folic Acid', ' Potassium Iodide', ' Menadione Sodium Bisulfite Complex (Source of Vitamin K)', ' Biotin', ' Vitamin B12 Supplement.']"
Iams Purrfect Delights Tuna-Topia Dinner Flaked in Sauce Canned Cat Food,Iams,$14.16,3.0,24.0,0.19666666666666666,"['Fish Broth', ' Tuna', ' Modified Tapioca Starch', ' Sunflower Oil', ' Natural Flavor', ' Calcium Sulfate', ' Tricalcium Phosphate', ' Guar Gum', ' Taurine', ' Minerals (Iron Glycine Complex', ' Zinc Glycine Complex', ' Manganese Glycine Complex', ' Copper Glycine Complex', ' Sodium Selenite', ' Potassium Iodide)', ' Choline Chloride', ' Carrageenan', ' Vitamins (Vitamin E Supplement', ' Niacin Supplement', ' Vitamin A Supplement', ' Vitamin B12 Supplement', ' Pyridoxine Hydrochloride (Source of Vitamin B6)', ' Calcium Pantothenate', ' Riboflavin Supplement (Source of Vitamin B2)', ' Biotin Supplement', ' Vitamin D3 Supplement', ' Folic Acid', ' Menadione Sodium Bisulfite Complex (Source of Vitamin K3))', ' Thiamine Mononitrate (Source of Vitamin B1)', ' Magnesium Oxide', ' Sodium Nitrite (To Promote Color Retention).']"
Fancy Feast Medleys Shredded Tuna Fare Canned Cat Food,Fancy Feast,$18.96,3.0,24.0,0.26333333333333336,"['Fish Broth', ' Tuna', ' Wheat Gluten', ' Liver', ' Meat By-Products', ' Spinach', ' Chicken', ' Corn Starch-Modified', ' Artificial and Natural Flavors', ' Tricalcium Phosphate', ' Soy Protein Concentrate', ' Salt', ' Added Color', ' Potassium Chloride', ' Taurine', ' Choline Chloride', ' Magnesium Sulfate', ' Red 3', ' Thiamine Mononitrate', ' Vitamin E Supplement', ' Zinc Sulfate', ' Ferrous Sulfate', ' Niacin', ' Calcium Pantothenate', ' Vitamin A Supplement', ' Menadione Sodium Bisulfite Complex (Source of Vitamin K Activity)', ' Copper Sulfate', ' manganese Sulfate', ' Pyridoxine Hydrochloride', ' Riboflavin Supplement', ' Vitamin B-12 Supplement', ' Biotin', ' Folic Acid', ' Vitamin D-3 Supplement', ' Potassium Iodide. C-6722.']"
American Journey Minced Salmon & Tuna Recipe in Gravy Grain-Free Canned Cat Food,American Journey,$22.99,3.0,24.0,0.3193055555555555,"['Salmon', ' Fish Broth', ' Chicken Broth', ' Chicken Liver', ' Tuna', ' Chicken', ' Dried Egg White', ' Peas', ' Natural Flavor', ' Sunflower Oil', ' Dried Egg Product', ' Guar Gum', ' Flaxseed', ' Sodium Phosphate', ' Salt', ' Taurine', ' Calcium Carbonate', ' Potassium Chloride', ' Cranberries', ' Blueberries', ' Choline Chloride', ' Tricalcium Phosphate', ' Inulin', ' DL-Methionine', ' Iron Proteinate', ' Zinc Proteinate', ' Thiamine Mononitrate', ' Fish Oil (Preserved with Mixed Tocopherols)', ' Vitamin E Supplement', ' Copper Proteinate', ' Manganese Proteinate', ' Sodium Selenite', ' Niacin Supplement', ' d-Calcium Pantothenate', ' Pyridoxine Hydrochloride', ' Riboflavin Supplement', ' Vitamin A Supplement', ' Biotin', ' Potassium Iodide', ' Vitamin D3 Supplement', ' Vitamin B12 Supplement', ' Folic Acid', ' Rosemary Extract.']"
