product,brand,price,oz_per_can,num_cans,price_per_oz,ingredients
Blue Buffalo Healthy Gourmet Flaked Chicken Entree in Gravy Canned Cat Food,Blue Buffalo,$27.95,5.5,24.0,0.21174242424242423,"['Chicken', ' Chicken Broth', ' Water', ' Chicken Liver', ' Dried Egg', ' Potato Starch', ' Natural Flavor', ' Sodium Phosphate', ' Salt', ' Guar Gum', ' Potassium Chloride', ' Carrageenan', ' Flaxseed (Source of Omega 3 and 6 Fatty Acids)', ' Ground Brown Rice', ' Carrots', ' Sweet Potatoes', ' Cranberries', ' Taurine', ' Choline Chloride', ' Iron Amino Acid Chelate', ' Zinc Amino Acid Chelate', ' Vitamin E Supplement', ' Thiamine Mononitrate (Vitamin B1)', ' Copper Amino Acid Chelate', ' Manganese Amino Acid Chelate', ' Sodium Selenite', ' Niacin Supplement (Vitamin B3)', ' Calcium Pantothenate (Vitamin B5)', ' Pyridoxine Hydrochloride (Vitamin B6)', ' Riboflavin Supplement (Vitamin B2)', ' Vitamin A Supplement', ' Biotin (Vitamin B7)', ' Potassium Iodide', ' Vitamin D3 Supplement', ' Vitamin B12 Supplement', ' Folic Acid (Vitamin B9).']"
Friskies Cat Concoctions with Scrumptious Salmon & Chicken Liver Dinner Pate Canned Cat Food,Friskies,$13.44,5.5,24.0,0.10181818181818181,"['Salmon', ' Meat By-Products', ' Liver', ' Water Sufficient for Processing', ' Chicken By-Products', ' Chicken Hearts & Livers', ' Fish', ' Rice', ' Artificial and Natural Flavors', ' Added Color', ' Guar Gum', ' Tricalcium Phosphate', ' Potassium Chloride', ' Salt', ' Carrageenan', ' Magnesium Sulfate', ' Red 3', ' Taurine', ' Choline Chloride', ' Vitamin E Supplement', ' Zinc Sulfate', ' Thiamine Mononitrate', ' Ferrous Sulfate', ' Niacin', ' Sodium Nitrite (To Promote Color Retention)', ' Copper Sulfate', ' Manganese Sulfate', ' Calcium Pantothenate', ' Vitamin A Supplement', ' Menadione Sodium Bisulfite Complex (Source of Vitamin K Activity)', ' Pyridoxine Hydrochloride', ' Riboflavin Supplement', ' Vitamin B-12 Supplement', ' Biotin', ' Folic Acid', ' Vitamin D-3 Supplement', ' Potassium Iodide.']"
Wellness Minced Chicken Dinner Grain-Free Canned Cat Food,Wellness,$45.11,5.5,24.0,0.34174242424242424,"['Chicken', ' Chicken Broth', ' Water Sufficient For Processing', ' Dried Ground Peas', ' Dried Egg Whites', ' Tomatoes', ' Carrots', ' Natural Flavor', ' Dried Egg Product', ' Guar Gum', ' Sodium Phosphate', ' Ground Flaxseed', ' Salt', ' Potassium Chloride', ' Choline Chloride', ' Cranberries', ' Minerals (Iron Amino Acid Chelate', ' Zinc Amino Acid Chelate', ' Copper Amino Acid Chelate', ' Manganese Amino Acid Chelate', ' Sodium Selenite', ' Potassium Iodide)', ' Vitamins (Thiamine Mononitrate', ' Vitamin E Supplement', ' Niacin', ' d-Calcium Pantothenate', ' Pyridoxine Hydrochloride', ' Riboflavin Supplement', ' Vitamin A Supplement', ' Biotin', ' Vitamin D3 Supplement', ' Vitamin B12 Supplement', ' Folic Acid)', ' Taurine.']"
Purina Pro Plan Focus Sensitive Skin & Stomach Classic Duck Grain-Free Entree Canned Cat Food,Purina Pro Plan,$23.28,3.0,24.0,0.32333333333333336,"['Duck', ' Liver', ' Meat By-Products', ' Water Sufficient For Processing', ' Ocean Whitefish', ' Inulin', ' Essential Nutrients And Other Ingredients: Minerals (Potassium Chloride', ' Tricalcium Phosphate', ' Salt', ' Zinc Sulfate', ' Ferrous Sulfate', ' Manganese Sulfate', ' Copper Sulfate', ' Potassium Iodide)', ' Vitamins (Choline', ' Vitamin E', ' Vitamin B-1', ' Vitamin B-3', ' Vitamin B-5', ' Vitamin A', ' Vitamin K', ' Vitamin B-6', ' Vitamin B-2', ' Vitamin B-12', ' Vitamin B-7', ' Folic Acid', ' Vitamin D-3)', ' Guar Gum', ' Taurine. A466217']"
Friskies Savory Shreds Chicken & Salmon Dinner in Gravy Canned Cat Food,Friskies,$11.99,5.5,24.0,0.09083333333333334,"['Water Sufficient for Processing', ' Meat By-Products', ' Chicken', ' Wheat Gluten', ' Turkey', ' Corn Starch-Modified', ' Soy Flour', ' Salmon', ' Artificial and Natural Flavors', ' Calcium Phosphate', ' Taurine', ' Added Color (Red 3 and Other Color)', ' Potassium Chloride', ' Salt', ' Choline Chloride', ' Zinc Sulfate', ' Thiamine Mononitrate', ' Vitamin E Supplement', ' Ferrous Sulfate', ' Niacin', ' Copper Sulfate', ' Manganese Sulfate', ' Calcium Pantothenate', ' Vitamin A Supplement', ' Menadione Sodium Bisulfite Complex (Source of Vitamin K Activity)', ' Xanthan Gum', ' Pyridoxine Hydrochloride', ' Riboflavin Supplement', ' Vitamin B-12 Supplement', ' Biotin', ' Folic Acid', ' Vitamin D-3 Supplement', ' Potassium Iodide.']"
Friskies Classic Pate Mariner's Catch Canned Cat Food,Friskies,$13.44,5.5,24.0,0.10181818181818181,"['Fish', ' Water Sufficient for Processing', ' Meat By-Products', ' Liver', ' Poultry By-Products', ' Rice', ' Artificial and Natural Flavors', ' Calcium Phosphate', ' Guar Gum', ' Added Color', ' Potassium Chloride', ' Carrageenan', ' Salt', ' Magnesium Sulfate', ' Red 3', ' Taurine', ' Vitamin E Supplement', ' Thiamine Mononitrate', ' Zinc Sulfate', ' Ferrous Sulfate', ' Niacin', ' Calcium Pantothenate', ' Vitamin A Supplement', ' Copper Sulfate', ' Manganese Sulfate', ' Menadione Sodium Bisulfite Complex (Source of Vitamin K Activity)', ' Pyridoxine Hydrochloride', ' Riboflavin Supplement', ' Vitamin B-12 Supplement', ' Biotin', ' Folic Acid', ' Vitamin D-3 Supplement', ' Potassium Iodide.']"
Purina Pro Plan Veterinary Diets UR St/Ox Urinary Formula Canned Cat Food,Purina Pro Plan Veterinary Diets,$48.99,5.5,24.0,0.37113636363636365,"['Meat By-Products', ' Water Sufficient for Processing', ' Liver', ' Chicken', ' Poultry By-Products', ' Rice', ' Calcium Gluconate', ' Oat Fiber', ' Guar Gum', ' Sodium Bisulfate', ' Potassium Chloride', ' Caramel Color', ' Carrageenan', ' Salt', ' Taurine', ' Vitamin E Supplement', ' Calcium Phosphate', ' Zinc Sulfate', ' Thiamine Mononitrate', ' Ferrous Sulfate', ' Manganese Sulfate', ' Vitamin A Supplement', ' Pyridoxine Hydrochloride', ' Copper Sulfate', ' Niacin', ' Vitamin B-12 Supplement', ' Riboflavin Supplement', ' Calcium Pantothenate', ' Menadione Sodium Bisulfite Complex (Source of Vitamin K Activity)', ' Vitamin D-3 Supplement', ' Folic Acid', ' Potassium Iodide', ' Biotin.']"
Hill's Science Diet Adult Healthy Cuisine Roasted Chicken & Rice Medley Canned Cat Food,Hill's Science Diet,$26.64,2.8,24.0,0.3964285714285715,"['Chicken Broth', ' Chicken', ' Pork Liver', ' Carrots', ' Rice', ' Spinach', ' Rice Starch', ' Chicken Liver Flavor', ' Powdered Cellulose', ' Wheat Gluten', ' Chicken Fat', ' Potassium Alginate', ' Calcium Chloride', ' Iodized Salt', ' Dicalcium Phosphate', ' Guar Gum', ' Soybean Oil', ' Calcium Lactate', ' Calcium Gluconate', ' Choline Chloride', ' L-Lysine', ' vitamins (Vitamin E Supplement', ' Ascorbic Acid (source of Vitamin C)', ' Thiamine Mononitrate', ' Niacin Supplement', ' Pyridoxine Hydrochloride', ' Calcium Pantothenate', ' Vitamin B12 Supplement', ' Riboflavin Supplement', ' Biotin', ' Vitamin D3 Supplement', ' Folic Acid)', ' Taurine', ' Sodium Tripolyphosphate', ' minerals (Zinc Oxide', ' Ferrous Sulfate', ' Manganese Sulfate', ' Copper Sulfate', ' Calcium Iodate)', ' Beta-Carotene.']"
Friskies Prime Filets Chicken & Tuna Dinner in Gravy Canned Cat Food,Friskies,$13.44,5.5,24.0,0.10181818181818181,"['Water', ' Liver', ' Chicken', ' Wheat Gluten', ' Meat By-Products', ' Soy Flour', ' Tuna', ' Corn Starch-Modified', ' Artificial And Natural Flavors', ' Tricalcium Phosphate', ' MINERALS [Potassium Chloride', ' Zinc Sulfate', ' Ferrous Sulfate', ' Manganese Sulfate', ' Copper Sulfate', ' Potassium Iodide]', ' Added Color', ' Salt', ' Taurine', ' Choline Chloride', ' VITAMINS [Thiamine Mononitrate (Vitamin B-1)', ' Vitamin E Supplement', ' Niacin (Vitamin B-3)', ' Calcium Pantothenate (Vitamin B-5)', ' Vitamin A Supplement', ' Menadione Sodium Bisulfite Complex (Vitamin K)', ' Pyridoxine Hydrochloride (Vitamin B-6)', ' Riboflavin Supplement (Vitamin B-2)', ' Vitamin B-12 Supplement', ' Biotin (Vitamin B-7)', ' Folic Acid (Vitamin B-9)', ' Vitamin D-3 Supplement]. F611018.']"
Hill's Science Diet Adult 7+  Savory Chicken Entree Canned Cat Food,Hill's Science Diet,$30.00,5.5,24.0,0.22727272727272727,"['Water', ' Chicken', ' Turkey Giblets', ' Pork By-Products', ' Pork Liver', ' Corn Starch', ' Corn Gluten Meal', ' Wheat Flour', ' Soybean Meal', ' Powdered Cellulose', ' Chicken Fat', ' Rice', ' Chicken Liver Flavor', ' Titanium Dioxide color', ' Potassium Chloride', ' Guar Gum', ' Fish Oil', ' Natural Flavor', ' Brewers Dried Yeast', ' Choline Chloride', ' Locust Bean Gum', ' vitamins (Vitamin E Supplement', ' Thiamine Mononitrate', ' Ascorbic Acid (source of Vitamin C)', ' Niacin Supplement', ' Pyridoxine Hydrochloride', ' Calcium Pantothenate', ' Vitamin B12 Supplement', ' Riboflavin Supplement', ' Biotin', ' Vitamin D3 Supplement', ' Folic Acid)', ' Carrageenan', ' Dicalcium Phosphate', ' Potassium Citrate', ' Taurine', ' Calcium Carbonate', ' DL-Methionine', ' Iodized Salt', ' minerals (Zinc Oxide', ' Ferrous Sulfate', ' Manganese Sulfate', ' Copper Sulfate', ' Calcium Iodate)', ' Magnesium Oxide', ' Beta-Carotene.']"
Purina Pro Plan Focus Adult Urinary Tract Health Formula with Salmon Classic Canned Cat Food,Purina Pro Plan,$23.28,3.0,24.0,0.32333333333333336,"['Meat By-Products', ' Chicken By-Products', ' Water Sufficient For Processing', ' Salmon', ' Rice', ' Guar Gum', ' Added Color', ' Potassium Chloride', ' Salt', ' Red 3', ' Carrageenan', ' Taurine', ' Vitamin E Supplement', ' Zinc Sulfate', ' Thiamine Mononitrate', ' Ferrous Sulfate', ' Niacin', ' Sodium Nitrite (to promote color retention)', ' Copper Sulfate', ' Manganese Sulfate', ' Calcium Pantothenate', ' Vitamin A Supplement', ' Menadione Sodium Bisulfite Complex (source of Vitamin K Activity)', ' Pyridoxine Hydrochloride', ' Riboflavin Supplement', ' Vitamin B-12 Supplement', ' Biotin', ' Folic Acid', ' Vitamin D-3 Supplement', ' Potassium Iodide.']"
9 Lives Surf 'N Turf Favorites Variety Canned Cat Food,9 Lives,$8.32,5.5,24.0,0.06303030303030303,"['Tender Morsels With Real Salmon In Sauce (8 Cans): Water Sufficient for Processing', ' Meat By-Products', ' Chicken', ' Turkey', ' Soy Protein Concentrate', ' Wheat Flour', ' Modified Corn Starch', ' Salmon', ' Vegetable Oil', ' Glycine', ' Brewers Yeast', ' Choline Chloride', ' Titanium Dioxide (Color)', ' Salt', ' DL Methionine', ' Vitamins (Vitamin E Supplement', ' Vitamin A Supplement', ' Thiamine Mononitrate', ' Niacin Supplement', ' D-Calcium Pantothenate', ' Riboflavin Supplement', ' Pyridoxine Hydrochloride', ' Menadione Sodium Bisulfite Complex', ' Vitamin D3 Supplement', ' Folic Acid', ' Biotin', ' Vitamin B12 Supplement)', ' Taurine', ' Red #3', ' Minerals (Ferrous Sulfate', ' Zinc Oxide', ' Manganous Oxide', ' Copper Sulfate', ' Calcium Iodate', ' Sodium Selenite).']"
Fancy Feast Grilled Turkey Feast in Gravy Canned Cat Food,Fancy Feast,$17.28,3.0,24.0,0.24000000000000002,"['Turkey Broth', ' Turkey', ' Liver', ' Wheat Gluten', ' Meat By-Products', ' Corn Starch-Modified', ' Artificial And Natural Flavors', ' Salt', ' Soy Protein Concentrate', ' Tricalcium Phosphate', ' Added Color', ' Minerals [Potassium Chloride', ' Magnesium Sulfate', ' Zinc Sulfate', ' Ferrous Sulfate', ' Copper Sulfate', ' Manganese Sulfate', ' Potassium Iodide]', ' Taurine', ' Choline Chloride', ' Vitamins [Thiamine Mononitrate (Vitamin B-1)', ' Vitamin E Supplement', ' Niacin (Vitamin B-3)', ' Calcium Pantothenate (Vitamin B-5)', ' Vitamin A Supplement', ' Menadione Sodium Bisulfite Complex (Vitamin K)', ' Pyridoxine Hydrochloride (Vitamin B-6)', ' Riboflavin Supplement (Vitamin B-2)', ' Vitamin B-12 Supplement', ' Biotin (Vitamin B-7)', ' Folic Acid (Vitamin B-9)', ' Vitamin D-3 Supplement]. D-6930.']"
Blue Buffalo Healthy Gourmet Kitten Multi Pack with Chicken Entrée Cat Food Trays,Blue Buffalo,$4.89,3.0,6.0,0.27166666666666667,"['Chicken', ' Chicken Liver', ' Chicken Broth', ' Dried Egg', ' Fish Oil (Source Of Dha-Docosahexaenoic Acid)', ' Natural Flavor', ' Flaxseed (Source Of Omega 3 And 6 Fatty Acids)', ' Brown Rice', ' Guar Gum', ' Carrots', ' Sweet Potatoes', ' Potassium Chloride', ' Taurine', ' Salt', ' Carrageenan', ' Cassia Gum', ' Cranberries', ' Choline Chloride', ' Iron Amino Acid Chelate', ' Zinc Amino Acid Chelate', ' Vitamin E Supplement', ' Thiamine Mononitrate (Vitamin B1)', ' Copper Amino Acid Chelate', ' Manganese Amino Acid Chelate', ' Sodium Selenite', ' Niacin Supplement (Vitamin B3)', ' Calcium Pantothenate (Vitamin B5)', ' Pyridoxine Hydrochloride (Vitamin B6)', ' Riboflavin Supplement (Vitamin B2)', ' Vitamin A Supplement', ' Biotin (Vitamin B7)', ' Potassium Iodide', ' Vitamin D3 Supplement', ' Vitamin B12 Supplement', ' Folic Acid (Vitamin B9).']"
Fussie Cat Premium Tuna with Chicken Formula in Aspic Grain-Free Canned Cat Food,Fussie Cat,$33.36,82.0,24.0,0.016951219512195123,"['Tuna', ' Water Sufficient for Processing', ' Boneless Chicken', ' Sunflower Seed Oil', ' Tricalcium Phosphate', ' Locust Bean Gum', ' Carrageenan', ' Guar Gum', ' Potassium Chloride', ' Choline Chloride', ' Fructooligosaccharide', ' Taurine', ' Zinc Sulfate', ' Vitamin E', ' Supplement', ' Ferrous Sulfate', ' Thiamine Mononitrate (Source of Vitamin B1)', ' Nicotinic Acid (Source of Vitamin B3)', ' Calcium Pantothenate', ' Vitamin A Supplement', ' Potassium Iodide', ' Manganese Sulfate', ' Copper Sulfate', ' Vitamin D3 Supplement', ' Riboflavin Supplement (Source of Vitamin B2)', ' Pyridoxine Hydrochloride (Source of Vitamin B6)', ' Folic Acid', ' Menadione Sodium Bisulfite Complex', ' Vitamin B12 Supplement.']"
Friskies Prime Filets with Ocean Whitefish & Tuna in Sauce Canned Cat Food,Friskies,$12.72,5.5,24.0,0.09636363636363637,"['Water', ' Liver', ' Wheat Gluten', ' Meat By-Products', ' Ocean Whitefish', ' Chicken', ' Soy Flour', ' Tuna', ' Corn Starch-Modified', ' Artificial And Natural Flavors', ' Tricalcium Phosphate', ' MINERALS [Potassium Chloride', ' Mono And Dicalcium Phosphate', ' Magnesium Sulfate', ' Zinc Sulfate', ' Ferrous Sulfate', ' Copper Sulfate', ' Manganese Sulfate', ' Potassium Iodide]', ' Added Color', ' Salt', ' Taurine', ' Choline Chloride', ' VITAMINS [Thiamine Mononitrate (Vitamin B-1)', ' Vitamin E Supplement', ' Niacin (Vitamin B-3)', ' Calcium Pantothenate (Vitamin B-5)', ' Vitamin A Supplement', ' Menadione Sodium Bisulfite Complex (Vitamin K)', ' Pyridoxine Hydrochloride (Vitamin B-6)', ' Riboflavin Supplement (Vitamin B-2)', ' Vitamin B-12 Supplement', ' Biotin (Vitamin B-7)', ' Folic Acid (Vitamin B-9)', ' Vitamin D-3 Supplement]', ' Red 3. F611418.']"
Friskies Savory Shreds with Salmon in Sauce Canned Cat Food,Friskies,$16.99,5.5,24.0,0.1287121212121212,"['Water Sufficient for Processing', ' Poultry', ' Meat By-Products', ' Salmon', ' Wheat Gluten', ' Corn Starch-Modified', ' Soy Flour', ' Artificial and Natural Flavors', ' Calcium Phosphate', ' Added Color (Red 3 and Other Color)', ' Potassium Chloride', ' Choline Chloride', ' Taurine', ' Salt', ' Zinc Sulfate', ' Thiamine Mononitrate', ' Vitamin E Supplement', ' Ferrous Sulfate', ' Niacin', ' Copper Sulfate', ' Manganese Sulfate', ' Calcium Pantothenate', ' Vitamin A Supplement', ' Menadione Sodium Bisulfite Complex (Source of Vitamin K Activity)', ' Pyridoxine Hydrochloride', ' Riboflavin Supplement', ' Vitamin B-12 Supplement', ' Biotin', ' Folic Acid', ' Vitamin D-3 Supplement', ' Potassium Iodide.']"
Purina Pro Plan Veterinary Diets NF Kidney Function Advanced Care Formula Canned Cat Food,Purina Pro Plan Veterinary Diets,$47.99,5.5,24.0,0.3635606060606061,"['Old Formulation: Water Sufficient For Processing', ' Beef', ' Poultry By-Products', ' Rice', ' Meat By-Products', ' Chicken', ' Calcium Gluconate', ' Powdered Cellulose', ' Artificial And Natural Flavors', ' Guar Gum', ' Potassium Citrate', ' Potassium Chloride', ' Magnesium Sulfate', ' Carrageenan', ' Vitamin E Supplement', ' Choline Chloride', ' Taurine', ' Zinc Sulfate', ' Thiamine Mononitrate', ' Mono And Dicalcium Phosphate', ' Ferrous Sulfate', ' Niacin', ' Calcium Pantothenate', ' Vitamin A Supplement', ' Copper Sulfate', ' Menadione Sodium Bisulfite Complex (Source Of Vitamin K Activity)', ' Manganese Sulfate', ' Pyridoxine Hydrochloride', ' Riboflavin Supplement', ' Vitamin B-12 Supplement', ' Biotin', ' Folic Acid', ' Potassium Iodide', ' Vitamin D-3 Supplement', ' Sodium Selenite. A-2534.']"
Tiny Tiger Pate Chicken Recipe Grain-Free Canned Cat Food,Tiny Tiger,$12.99,3.0,24.0,0.18041666666666667,"['Chicken', ' Chicken Broth', ' Liver', ' Meat By-Products', ' Fish', ' Natural Flavor', ' Guar Gum', ' Potassium Chloride', ' Added Color', ' Choline Chloride', ' Vitamins (Thiamine Mononitrate', ' Vitamin E Supplement', ' Niacin Supplement', ' D-Calcium Pantothenate', ' Pyridoxine Hydrochloride', ' Riboflavin Supplement', ' Vitamin A Supplement', ' Biotin', ' Vitamin D3 Supplement', ' Vitamin B12 Supplement', ' Folic Acid)', ' Minerals (Ferrous Sulfate', ' Zinc Oxide', ' Copper Proteinate', ' Sodium Selenite', ' Manganese Sulfate', ' Potassium Iodide)', ' Taurine', ' Salt', ' Magnesium Sulfate', ' Sodium Nitrite (To Promote Color Retention).']"
Purina Pro Plan Focus Healthy Metabolism Formula Chicken Entrée in Gravy Adult Canned Cat Food,Purina Pro Plan,$23.28,3.0,24.0,0.32333333333333336,"['Water Sufficient for Processing', ' Chicken', ' Liver', ' Wheat Gluten', ' Meat By Products', ' Corn Starch Modified', ' Artificial and Natural Flavors', ' Salt', ' Soy Protein Concentrate', ' Tricalcium Phosphate', ' Potassium Chloride', ' Added Color', ' Taurine', ' Choline Chloride', ' Vitamin E Supplement', ' Thiamine Mononitrate', ' Mono and Dicalcium Phosphate', ' Zinc Sulfate', ' L Carnitine', ' Ferrous Sulfate', ' Niacin', ' Calcium Pantothenate', ' Vitamin A Supplement', ' Menadione Sodium Bisulfite Complex (Source of Vitamin K Activity)', ' Copper Sulfate', ' Manganese Sulfate', ' Pyridoxine Hydrochloride', ' Riboflavin Supplement', ' Vitamin B 12 Supplement', ' Biotin', ' Folic Acid', ' Vitamin D 3 Supplement', ' and Potassium Iodide.']"
Friskies Tasty Treasures with Chicken & Cheese in Gravy Canned Cat Food,Friskies,$16.98,5.5,24.0,0.12863636363636363,"['Water', ' Chicken', ' Liver', ' Wheat Gluten', ' Meat By-Products', ' Vegetable Starch-Modified', ' Soy Flour', ' Cheese', ' Artificial And Natural Flavors', ' Tricalcium Phosphate', ' Sodium Caseinate', ' Vegetable Oil', ' Corn Starch', ' MINERALS [Potassium Chloride', ' Zinc Sulfate', ' Ferrous Sulfate', ' Manganese Sulfate', ' Copper Sulfate', ' Potassium Iodide]', ' Added Color', ' Salt', ' Dried Whey', ' Taurine', ' Choline Chloride', ' VITAMINS [Thiamine Mononitrate (Vitamin B-1)', ' Vitamin E Supplement', ' Niacin (Vitamin B-3)', ' Calcium Pantothenate (Vitamin B-5)', ' Vitamin A Supplement', ' Menadione Sodium Bisulfite Complex (Vitamin K)', ' Pyridoxine Hydrochloride (Vitamin B-6)', ' Riboflavin Supplement (Vitamin B-2)', ' Vitamin B-12 Supplement', ' Biotin (Vitamin B-7)', ' Folic Acid (Vitamin B-9)', ' Vitamin D-3 Supplement]', ' Sorbic Acid (A Preservative). D617018.']"
Sheba Perfect Portions Grain-Free Roasted Turkey Entree Cat Food Trays,Sheba,$19.20,2.6,24.0,0.30769230769230765,"['Turkey', ' Turkey Broth', ' Meat By-Products', ' Chicken', ' Chicken Liver', ' Poultry By-Products', ' Natural Flavor', ' Minerals (Potassium Chloride', ' Calcium Carbonate', ' Magnesium Sulfate', ' Zinc Sulfate', ' Iron Sulfate', ' Manganese Sulfate', ' Potassium Iodide', ' Copper Sulfate)', ' Guar Gum', ' Added Color', ' Sodium Tripolyphosphate', ' Fish Oil (Preserved with Mixed Tocopherols)', ' Vitamins (Choline Chloride', ' Thiamine Mononitrate [Vitamin B1]', ' Vitamin E Supplement', ' Pyridoxine Hydrochloride [Vitamin B6]', ' Vitamin D3 Supplement', ' Folic Acid', ' Menadione Sodium Bisulfite Complex [Source of Vitamin K Activity])', ' Dl-Methionine', ' Salt', ' Taurine.']"
Iams Perfect Portions Healthy Kitten Chicken Recipe Pate Grain-Free Cat Food Trays,Iams,$22.32,2.6,24.0,0.35769230769230764,"['Chicken', ' Chicken Broth', ' Chicken Liver', ' Dried Egg Product', ' Guar Gum', ' Added Color', ' Potassium Chloride', ' Fish Oil (Preserved with Mixed Tocopherols)', ' Sodium Tripolyphosphate', ' Magnesium Sulfate', ' Taurine', ' Calcium Carbonate', ' DL-Methionine', ' Choline Chloride', ' Salt', ' Thiamine Mononitrate (Vitamin B1)', ' Vitamin E Supplement', ' Zinc Sulfate', ' Ferrous Sulfate', ' Manganese Sulfate', ' Potassium Iodide', ' Pyridoxine Hydrochloride (Vitamin B6)', ' Copper Sulfate', ' Vitamin D3 Supplement', ' Folic Acid', ' Menadione Sodium Bisulfite Complex (Vitamin K).']"
Fancy Feast Gourmet Naturals Trout & Tuna Recipe Pate Canned Cat Food,Fancy Feast,$10.20,3.0,12.0,0.2833333333333333,"['Trout', ' Chicken', ' Fish Broth', ' Liver', ' Tuna', ' Natural Flavors', ' Minerals\u202f[Potassium Chloride', ' Mono And Dicalcium Phosphate', ' Magnesium Sulfate', ' Zinc Sulfate', ' Ferrous Sulfate', ' Copper Sulfate', ' Manganese Sulfate', ' Potassium Iodide]', ' Guar Gum', ' Salt', ' Taurine', ' Choline Chloride', ' Vitamins\u202f[Thiamine Mononitrate (Vitamin B-1)', ' Vitamin E Supplement', ' Niacin (Vitamin B-3)', ' Calcium Pantothenate (Vitamin B-5)', ' Vitamin A Supplement', ' Menadione Sodium Bisulfite Complex (Vitamin K)', ' Pyridoxine Hydrochloride (Vitamin B-6)', ' Riboflavin Supplement (Vitamin B-2)', ' Vitamin B-12 Supplement', ' Biotin (Vitamin B-7)', ' Folic Acid (Vitamin B-9)', ' Vitamin D-3 Supplement].A651018']"
Fancy Feast Creamy Delights Chicken Feast Canned Cat Food,Fancy Feast,$13.20,3.0,24.0,0.18333333333333332,"['Chicken', ' Liver', ' Meat By-Products', 'Poultry Broth', ' Fish', ' Milk', ' Artificial and Natural Flavors', ' Added Color', ' Guar Gum', ' Tricalcium Phosphate', ' Potassium Chloride', ' Salt', ' Magnesium Sulfate', ' Mono and Dicalcium Phosphate', ' Taurine', ' Zinc Sulfate', ' Thiamine Mononitrate', ' Vitamin E Supplement', ' Ferrous Sulfate', ' Niacin', ' Copper Sulfate', ' Manganese Sulfate', ' Calcium Pantothenate', ' Vitamin A Supplement', ' Menadione Sodium Bisulfite Complex (Vitamin K)', ' Pyridoxine Hydrochloride', ' Riboflavin Supplement', ' Vitamin B-12 Supplement', ' Biotin', ' Folic Acid', ' Vitamin D-3 Supplement', ' Potassium Iodide. A-7036.']"
Friskies Indoor Classic Pate Chicken Dinner Canned Cat Food,Friskies,$16.98,5.5,24.0,0.12863636363636363,"['Water Sufficient for Processing', ' Chicken', ' Liver', ' Meat By-Products', ' Rice', ' Powdered Cellulose', ' Spinach', ' Rice Flour', ' Artificial and Natural Flavors', ' Tricalcium Phosphate', ' Guar Gum', ' Added Color', ' Potassium Chloride', ' Carrageenan', ' Salt', ' Taurine', ' Choline Chloride', ' Dl-Methionine', ' Zinc Sulfate', ' Thiamine Mononitrate', ' Ferrous Sulfate', ' Vitamin E Supplement', ' Niacin', ' Copper Sulfate', ' Manganese Sulfate', ' Calcium Pantothenate', ' Vitamin A Supplement', ' Menadione Sodium Bisulfite Complex (Vitamin K)', ' Pyridoxine Hydrochloride', ' Riboflavin Supplement', ' Vitamin B-12 Supplement', ' Biotin', ' Folic Acid', ' Vitamin D-3 Supplement', ' Potassium Iodide. H-6082.']"
Friskies Extra Gravy Chunky with Chicken in Savory Gravy Canned Cat Food,Friskies,$11.04,5.5,24.0,0.08363636363636363,"['Water', ' Chicken', ' Liver', ' Meat By-Products', ' Wheat Gluten', ' Turkey', ' Soy Flour', ' Corn Starch-Modified', ' Artificial And Natural Flavors', ' Tricalcium Phosphate', ' MINERALS [Potassium Chloride', ' Mono And Dicalcium Phosphate', ' Zinc Sulfate', ' Ferrous Sulfate', ' Copper Sulfate', ' Manganese Sulfate', ' Potassium Iodide]', ' Taurine', ' Added Color', ' Salt', ' Choline Chloride', ' VITAMINS [Thiamine Mononitrate (Vitamin B-1)', ' Vitamin E Supplement', ' Niacin (Vitamin B-3)', ' Calcium Pantothenate (Vitamin B-5)', ' Vitamin A Supplement', ' Menadione Sodium Bisulfite Complex (Vitamin K)', ' Pyridoxine Hydrochloride (Vitamin B-6)', ' Riboflavin Supplement (Vitamin B-2)', ' Vitamin B-12 Supplement', ' Biotin (Vitamin B-7)', ' Folic Acid (Vitamin B-9)', ' Vitamin D-3 Supplement]. B626618.']"
Purina Pro Plan Focus Kitten Classic Salmon & Ocean Fish Entree Canned Cat Food,Purina Pro Plan,$23.28,3.0,24.0,0.32333333333333336,"['Salmon', ' Ocean Fish', ' Liver', ' Meat By-Products', ' Water Sufficient for Processing', ' Chicken', ' Artificial and Natural Flavors', ' Calcium Phosphate', ' Rice', ' Added Color', ' Guar Gum', ' Potassium Chloride', ' Salt', ' Choline Chloride', ' Taurine', ' Vitamin E Supplement', ' Thiamine Mononitrate', ' Zinc Sulfate', ' Ferrous Sulfate', ' Niacin', ' Copper Sulfate', ' Calcium Pantothenate', ' Manganese Sulfate', ' Vitamin A Supplement', ' Menadione Sodium Bisulfite Complex (Source of Vitamin K Activity)', ' Pyridoxine Hydrochloride', ' Riboflavin Supplement', ' Vitamin B-12 Supplement', ' Biotin', ' Folic Acid', ' Vitamin D-3 Supplement', ' Potassium Iodide.']"
Tiki Cat Hana Grill Ahi Tuna with Crab in Tuna Consomme Grain-Free Canned Cat Food,Tiki Cat,$12.89,6.0,8.0,0.2685416666666667,"['Tuna', ' Tuna Broth', ' Crab', ' Sunflower Seed Oil', ' Calcium Lactate', ' Tricalcium Phosphate', ' Tuna Fish Oil', ' Choline Chloride', ' Taurine', ' Vitamin E Supplement', ' Zinc Sulfate', ' Iron Sulfate', ' Thiamine Mononitrate (Vitamin B1)', ' Niacin (Vitamin B3)', ' Calcium Pantothenate', ' Manganese Sulfate', ' Vitamin A Supplement', ' Potassium Iodide', ' Copper Sulfate', ' Riboflavin Supplement (Vitamin B2)', ' Pyridoxine Hydrochloride (Vitamin B6)', ' Folic Acid', ' Vitamin D3 Supplement', ' Vitamin B12 Supplement.']"
