rating,name,price,num_cans,oz_per_can,review_text
5.0,blue-buffalo-healthy-gourmet-variety,10.98,12,3.0,"This cat food  is loved by my cats , one of them was breaking out in sores , switched food and all is well no more sores !!!! Healthy Happy cats !!!"
3.0,blue-buffalo-healthy-gourmet-variety,10.98,12,3.0,"A pretty good replacement for Fancy Feast. My cats nibble at it, but are not ""gobbling it up"". But I will keep giving it a try. They are learning."
3.0,blue-buffalo-healthy-gourmet-variety,10.98,12,3.0,"Most times our cats and kitten devour this product quickly.  it is healthy and got the nod from our vet, when we asked him if he approved."
3.0,blue-buffalo-healthy-gourmet-variety,10.98,12,3.0,"I have two cats, one will eat anything and the other is very picky. This food looks like very dried out wet food,both of my cats prefer more gravy. I will not be purchasing this again."
4.0,blue-buffalo-healthy-gourmet-variety,10.98,12,3.0,"I have been buying Blue Buffalo for my cats for the last 3 years. I only recently started buying them this variety pack, they seem to really like it. I'd been buying other variety packs from BB that they also seemed to like until recently. If I put this out, I know they will eat it. If I put something else out, there's a 50:50 chance it will go to waste. I hope BB doesn't go changing all their products around, it will be much harder to find my cats food they like. For now, this is a safe bet."
5.0,blue-buffalo-healthy-gourmet-variety,10.98,12,3.0,"My cat is 12 pounds, so I am using many cans a day to feed him. I would much prefer to use one or two cans a day and keep the leftovers in the fridge. It would be a lot less effort and a lot less trash. I feel like this is cheaper for Blue Buffalo as well??
Bigger cans = less work and less trash = happier environment = happier people and cats :)"
4.0,blue-buffalo-healthy-gourmet-variety,10.98,12,3.0,"Looking to change out some of our cat food for healthier food,
we have to do it slowly, not enough flavor in this brand to entice them."
5.0,blue-buffalo-healthy-gourmet-variety,10.98,12,3.0,I just wanted to break the monotony for my kitty and give him decent food rather than the other food that comes out dried up or smothered in gravy.
5.0,blue-buffalo-healthy-gourmet-variety,10.98,12,3.0,Since poor little Shadow had some kind of allergy where she throws up and breaks out. Blue Buffalo seems to be helping her and she loves it so far. I have 5 kitties so hopefully I can keep affording this for her.
1.0,blue-buffalo-healthy-gourmet-variety,10.98,12,3.0,Too much like pate...not flaky as described....not wet or juicy enough.Duck did not eat it so I gave it away
5.0,blue-buffalo-healthy-gourmet-variety,10.98,12,3.0,"my 11 year old furbaby began to eat a little bit and walk away.  she was losing weight.  so I got one pack of blue buffalo and put 1/4th of a can in her bowl.  at the second meal she was dancing and waiting for her bowl.  third meal had her tearing around the corner in anticipation of meal time.  I am happy to see her enjoying meals again, and giving me lots of loving afterward."
1.0,blue-buffalo-healthy-gourmet-variety,10.98,12,3.0,I wish my cats would eat this stuff but they flat do not like it. I have thrown away more than they have eaten. You think at least one of my cats out of two would like it but they won't even eat the tuna flavored one!! I tried everything to get them to eat it too. They just turn their noses up. Definitely will not buy again.
4.0,blue-buffalo-healthy-gourmet-variety,10.98,12,3.0,I have this food on autoship every week and it never disappoints to come on time and the babies love it.
1.0,blue-buffalo-healthy-gourmet-variety,10.98,12,3.0,"My 2 boys did not like this stuff at ALL.  Each time I put the 3 different flavours in their dishes, they took TWO BITES, and then LEFT them.  I ended up throwing more than 90% of this crap out.  PLUS, they smelled BAD (IMO)...and I think my boys thought so too, because when they sniffed them, they made faces."
3.0,blue-buffalo-healthy-gourmet-variety,10.98,12,3.0,"Meh. My 3 pickers started out with the 1st order  of this variety pack loving it.  So, I ordered more. It was all I could do to get them through the next order, and they no longer want it.  I even tried recently just buying one more single can of it from the local pet store and they still didn't want it.  I will say that they are all picky, but they will gulp other brands vs this. Definitely wouldn't discourage someone from trying it though."
5.0,blue-buffalo-healthy-gourmet-variety,10.98,12,3.0,I have 6 rescues each wth their own opinions on food. this was a winner and I loved the ingredients. A few of the cats have issues either sensitive tummies or immune disorders so this was great. I'm just sad you don't get a whole lot of product for your buck but it is quality.
5.0,blue-buffalo-healthy-gourmet-variety,10.98,12,3.0,"Both of my boys love the Blue Buffalo food and digest it really well. One of my cats was throwing up occasionally when he tried other foods, I had them on IAMS and Rachel Ray Nutrish previously. My older cat was also much more interested in this food than in any of the other canned food brands I tried. We are definitely sticking with Blue Buffalo."
5.0,blue-buffalo-healthy-gourmet-variety,10.98,12,3.0,My cat will not eat turkey or duck flavored foods but she loves all three flavors in this pack! I will be buying again.
4.0,blue-buffalo-healthy-gourmet-variety,10.98,12,3.0,My cat would not even look at this for a few days but when he saw it was all he had he started eating and it is the first cat food where he eats every bite
5.0,blue-buffalo-healthy-gourmet-variety,10.98,12,3.0,My little colony of feral cats found this food very pleasing -licked their plates clean!
5.0,blue-buffalo-healthy-gourmet-variety,10.98,12,3.0,My cats love this food. They all come running if they see me heading that direction giving me big kitten eyes and weaving in and out of my legs until the cab is opened. I have two cats that can’t stand each other but will eat this side by side without a grumble or incident because they are laser focused on the grub before them!
5.0,blue-buffalo-healthy-gourmet-variety,10.98,12,3.0,"My cat has recently lost quite a bit of weight and I got this food to maintain her current size, while also focusing on more of a protein-heavy diet. She's been on this food for about 5 months now and her weight has stayed the same, and she's as healthy as ever! She has a ton of energy and as a bonus, she absolutely loves this food. Gobbles it up faster than I can scoop it out of the can (like I said, she's a bit of a fatty...). Would highly recommend!!"
5.0,blue-buffalo-healthy-gourmet-variety,10.98,12,3.0,Our cats are such picky eaters and we were so frustrated trying so many types of food for them. We finally tried Blue buffalo and they loved it. The quality is high and the texture is very nice for them. Thanks Blue Buffalo!
5.0,blue-buffalo-healthy-gourmet-variety,10.98,12,3.0,Both of my cats love all Blue Buffalo products. Their coats are so shiny and their health is excellent.
5.0,blue-buffalo-healthy-gourmet-variety,10.98,12,3.0,I would like to have it in the indoor cat And in the   patie He loved it so much he licks the plate so clean that a Knox at on the floor
5.0,blue-buffalo-healthy-gourmet-variety,10.98,12,3.0,"My cat loved this food. One of my cats, Otis, is particularly picky. But he loved this food."
3.0,blue-buffalo-healthy-gourmet-variety,10.98,12,3.0,"The kittens love this food. But my kittens love every food. Haha. Anyhow - sorry for the grossness, but their feces smelled AWFUL. Like as soon as they went my entire house stank. I monitored to see which food was the culprit and it was this one. Now I give them only wellness and fancy feast kitten food and I’m not saying it smells like roses but it isn’t abnormally disgusting. If you’re noticing the same thing, try another brand."
5.0,blue-buffalo-healthy-gourmet-variety,10.98,12,3.0,1 of our 3 cats is very picky and she licked her bowl clean and then cleaned up what the other 2 cats left behind. In the year we have had her she has never even finished her portion of the other can foods we have tried.
3.0,blue-buffalo-healthy-gourmet-variety,10.98,12,3.0,"The order came exactly as promised. No problems whatsoever there; however, none of our three fur-blessings liked the food."
4.0,blue-buffalo-healthy-gourmet-variety,10.98,12,3.0,Both my indoor pussycats gobbled this great product up. Nice price & nothing beats having it delivered to your doorstep. WE LOVE CHEWY!
5.0,blue-buffalo-healthy-gourmet-variety,10.98,12,3.0,"One of my 3 inside cats will sometime throw up her canned food.  I decided to try something different and am currently giving them this canned food.  They seem to really like it and so far, no vomiting.  It's a bit more expensive, but that really doesn't matter to me."
4.0,blue-buffalo-healthy-gourmet-variety,10.98,12,3.0,"I have a finicky cat and he will only eat seafood and, since I don't have anyone to share with and he turned his nose up at the chicken, all chicken went in the garbage.  He absolutely loves the seafood."
4.0,blue-buffalo-healthy-gourmet-variety,10.98,12,3.0,"I think this is a great quality food.  However my two cats are pretty picky, they ate it but not as diligently as with other brands.  I am going to try Authority this next time. If they pick at that I will go back to Wellness Core."
5.0,blue-buffalo-healthy-gourmet-variety,10.98,12,3.0,Cuddles loved the Blue Buffalo food.  Thank you Chewy for offering this product at a reasonable price.
5.0,blue-buffalo-healthy-gourmet-variety,10.98,12,3.0,My cats get bored eating the same thing day after day.  The variety pack offers the opportunity for them to get some different flavor once in while. Basically they’re fed the tuna shrimp combination dinners. Some chicken now and then is right up their alley and ends there boredom. The convenience of having this delivered automatically every three weeks makes my life so easy.
2.0,blue-buffalo-healthy-gourmet-variety,10.98,12,3.0,"Cats won't eat it. So won't order again. None of the 11 cats I feed would eat it, so I'll go back to the other foods I buy for them."
5.0,blue-buffalo-healthy-gourmet-variety,10.98,12,3.0,I don't have to worry about any leftover food in their food bowls. They eat it all in one sitting which is very rare for my fur babies.
1.0,blue-buffalo-healthy-gourmet-variety,10.98,12,3.0,"My cats do not like this at all. First off It says flaked, but it looks like Pate with chunks. I wasted my money on this product, but will continue to shop with Chewy."
1.0,blue-buffalo-healthy-gourmet-variety,10.98,12,3.0,My kitty Rita loves canned tuna so I just assumed she would like this food. She didn’t even take a bite
5.0,blue-buffalo-healthy-gourmet-variety,10.98,12,3.0,All four of my cats love all the flavors.Its good to know there is nothing but good stuff in this food.
5.0,blue-buffalo-healthy-gourmet-variety,10.98,12,3.0,"It turns out that our fussy girl, Ms. Chairman Meow, truly only wants pate, not this flaked variety. I will likely pass it on to a less finicky feline."
2.0,blue-buffalo-healthy-gourmet-variety,10.98,12,3.0,"I am dissappointed that the description does not match the food.  This is not flaked, but compressed into little squares.  Our picky cat does like it better than some others otherwise I'd give 1 star"
5.0,blue-buffalo-healthy-gourmet-variety,10.98,12,3.0,My cats love this food.  There is no left over after feeding like other brands.  Their coats are healthier.  Love this.
5.0,blue-buffalo-healthy-gourmet-variety,10.98,12,3.0,I have one big kitty that will tell you when she doesn't like a food. She will talk from the time you let her in the house till the time she jumps on my desk and lays in front of my computer monitor. She likes Blue Buffalo.
5.0,blue-buffalo-healthy-gourmet-variety,10.98,12,3.0,I BOUGHT THIS TO TRY SOMETHING DIFFERENT BECAUSE MY BABIES SEEM TO HAVE GOTTEN BORED WITH FANCY FEAST AND THEY LOVED IT
5.0,blue-buffalo-healthy-gourmet-variety,10.98,12,3.0,My little heart branded cat loves this food so much that she remembers her feeding schesule better than I do
5.0,blue-buffalo-healthy-gourmet-variety,10.98,12,3.0,I have an older cat. I tried a lot of different foods. Once I found Blue Bufflalo my cat was extremely Happy! She started having some health issues and I needed to add a soft food. I brought her the flaked and she had no issues eating it! So now she eats both dry and canned food. She's enjoying her older years.
5.0,blue-buffalo-healthy-gourmet-variety,10.98,12,3.0,Cat seems to like it. Would buy again. Just trying out different kinds and brands. Love chewy.com.
5.0,blue-buffalo-healthy-gourmet-variety,10.98,12,3.0,My cat loves these. He eats them right down. He loves the shrimp salmon one the best
2.0,blue-buffalo-healthy-gourmet-variety,10.98,12,3.0,The actual food may be fine but it’s way to dry to please my cats. The more gravy the better or they won’t touch it!
5.0,blue-buffalo-healthy-gourmet-variety,10.98,12,3.0,"My 15 year old girl loves this food.  She has 3 different choices each day!  It’s easy on her digestive system and her black coat is sparkly and soft.  She’s hungry every morning and evening, she can’t wait!!"
5.0,blue-buffalo-healthy-gourmet-variety,10.98,12,3.0,"I have a 22 year old cat who has thyroid and kidney issues. I have to give him some prescription food, but he's such a darling, and he's always hungry, so I decided to give this a shot. So far he loves it. I just ordered some other Blue Buffalo for my other cats . We'll see how that works out. I'm also trying Blue Buffalo dog food for my very picky and very spoiled rat terrier."
5.0,blue-buffalo-healthy-gourmet-variety,10.98,12,3.0,"My cats love them, and I am transitioning them to more Blue Buffalo and less Fancy Feast."
5.0,blue-buffalo-healthy-gourmet-variety,10.98,12,3.0,One of our cats likes the variety of this and especially the brand having tried others...that is Benny ... His favorite is the fish and shrimp and only Blue will do.
4.0,blue-buffalo-healthy-gourmet-variety,10.98,12,3.0,My Kitties love Blue Buffalo and I feel good feeding them a quality meal.
1.0,blue-buffalo-healthy-gourmet-variety,10.98,12,3.0,"I have one picky eater and one 15 lb (she's on a diet okay!) girl who usually eats everything you put in front of her. The picky cat walked away from it, and the chubby one sniffed it, put her paw in it, tried violently to shake it off and then laid down in front of it and cried until we opened something else. Dramatic? Absolutely. To the point about her feelings? Definitely. It was resounding no from this house. :("
1.0,blue-buffalo-healthy-gourmet-variety,10.98,12,3.0,Unfortunately my 6 year old prima dona did not like any of the varieties of Blue Buffalo. She is usually a tuna and seafood junkie but turned her nose up and walked away. I'm back to Fancy Feast which she loves.
5.0,blue-buffalo-healthy-gourmet-variety,10.98,12,3.0,My 2 boys loved this food! They are picky on occasion and I forgot I ordered this so I was nervous I wasted money... but they loved it!!! Good combination of choices for them and an excellent brand!
5.0,blue-buffalo-healthy-gourmet-variety,10.98,12,3.0,My guys like it better than Fancy Feast  and it might be healthier.
5.0,blue-buffalo-healthy-gourmet-variety,10.98,12,3.0,My cat was being picky and not eating the food she's been eating fine for months. Decided to get her this in the hopes she would eat it and she did! She loves this stuff!
5.0,blue-buffalo-healthy-gourmet-variety,10.98,12,3.0,My fur babies would definitely give me a thumbs-up..... if they had thumbs!!
5.0,blue-buffalo-healthy-gourmet-variety,10.98,12,3.0,I was having a problem with one of the cats throwing up with my other soft food - but no issues since I switched to Healthy Gourmet.  They only get a tablespoon a day - but it seems to have made a difference.
3.0,blue-buffalo-healthy-gourmet-variety,10.98,12,3.0,My cat doesn't seem to love this food. Eats about half and leaves the rest to go to waste. He's not particularly picky so I don't know what gives. Probably won't purchase again.
4.0,blue-buffalo-healthy-gourmet-variety,10.98,12,3.0,"Tom my beloved cat was listless and seemed to have allergies with gunk in his ees when my vet recommended a change i food. We went to Blue Buffalo older cat with hairball an one month later he is bouncy, no issues with eyes. Increased appetite adn enthusiasm to be with people. Above all the most beautiful shiny coat and brightest sparkling eyes. Thank you !!"
1.0,blue-buffalo-healthy-gourmet-variety,10.98,12,3.0,My cats don't like this food at all!   They did ok with the pate but won't eat the flake and I bought two boxes
4.0,blue-buffalo-healthy-gourmet-variety,10.98,12,3.0,"Well, I have 5 rescued purr babies and 1 just loves it so much that she won’t share!!! This is really ok as the cans are small and sharing isn’t necessary. The only problem I have with the product is, when shipped with litter, the cans can be crushed and leak. Has nothing to do with the food quality though. As I said one of my girls can’t get enough...  LoL"
5.0,blue-buffalo-healthy-gourmet-variety,10.98,12,3.0,Tried it the first time  -   they LOVED the Tuna  -  wish I could have gotten a case of JUST the Tuna
5.0,blue-buffalo-healthy-gourmet-variety,10.98,12,3.0,All four of our cats loved this food.  However the cans are small and that makes this good food much too expensive for this Social Security recipient.  I probably will only Order this every other month to give them a treat.
1.0,blue-buffalo-healthy-gourmet-variety,10.98,12,3.0,Well this is not the one....dog likes it!!  Will keep trying other brands :/
5.0,blue-buffalo-healthy-gourmet-variety,10.98,12,3.0,"This canned food doesn't stay in the plate long.
Our cat was tired of the same thing and she is a super happy kitty with this."
5.0,blue-buffalo-healthy-gourmet-variety,10.98,12,3.0,"I recently switched from other brand to this product. it used to be one cat likes it, the other won't. But with this brand both of my cats love the food, and finish it every time. Price is very good compare to other websites. I'd recommend this to other cat lovers."
2.0,blue-buffalo-healthy-gourmet-variety,10.98,12,3.0,I'm sure this is quality food.  I have purchased other Blue products with a positive outcome.  This time my 2 cats would not eat this.  They prefer a food that's chopped with gravy and not a Pate form.  My usual is Fancy feast gravy lovers.  Will stick to that.
2.0,blue-buffalo-healthy-gourmet-variety,10.98,12,3.0,"My rescue is twelve years old and a very finicky eater. He prefers seafood to poultry, but I couldn't even get him to eat the tuna flavored, which has always been his favorite. The canned food itself didn't have a lot of gravy or juice which is a must have for my feline. If your cat is picky like mine, who won't eat paté or big chunks of meat, avoid this food. Despite being listed as flaked, the consistency was closer to that of paté."
4.0,blue-buffalo-healthy-gourmet-variety,10.98,12,3.0,"I think my cat like chicken better than fish, great product though !"
5.0,blue-buffalo-healthy-gourmet-variety,10.98,12,3.0,Certain fancy first made my cat throw up.  This food seem to agree with both of us.
5.0,blue-buffalo-healthy-gourmet-variety,10.98,12,3.0,"This is a great little variety pack. However, my cat is a picky eater. Turns out he doesn't like fish at all. He loves the Chicken flavor but turns his nose up to the fish flavors. Thankfully we have another cat that will eat the other flavors of the food."
5.0,blue-buffalo-healthy-gourmet-variety,10.98,12,3.0,"My 18 year old male cat has issues with constipation. I bought this for him, it helped."
5.0,blue-buffalo-healthy-gourmet-variety,10.98,12,3.0,"My cat just loves this product. She was on special diet and didn’t like it, so I shopped around and found this item. It seems to do the job."
5.0,blue-buffalo-healthy-gourmet-variety,10.98,12,3.0,"My grand-kitties love their food from chewy.  Thanks, chewy.com"
5.0,blue-buffalo-healthy-gourmet-variety,10.98,12,3.0,"Both cats seem to really like this stuff! Great price for what you get, will buy again."
1.0,fancy-feast-delights-cheddar-grilled,15.59,24,3.0,"Received a crumpled box with multiple cans cracked open. Seems unlikely that this happened during shipping since the shipping carton was intact with no damages. Since this is the second time this happened, I wonder if chewy is intentionally shipping damaged sets. Will definitely not order canned pet food from Chewy any more."
5.0,fancy-feast-delights-cheddar-grilled,15.59,24,3.0,"My 2 kitties love the texture and flavor of the cheddar food.  Can't find bulk package locally, so this is ideal.  This is the only canned food they totally leave clean bowls with. Nice with Chewy's fast delivery that I don't have to worry about ordering just a couple of days before I run out!"
5.0,fancy-feast-delights-cheddar-grilled,15.59,24,3.0,"My Tippy cat LOVES all things containing dairy. After trying to find a wet cat food flavor he'd appreciate (and actually eat), I decided to give these cheddar delights a try. He devours these 3 flavors, leaving absolutely no evidence in the bowl. 
If your cat loves harassing you when you are eating cereal, just to get in a few laps of the left over milk, licks the whipped cream off of any desserts, and demands to be given a few licks of your vanilla ice cream-this would be the brand for that kitty!!"
4.0,fancy-feast-delights-cheddar-grilled,15.59,24,3.0,"Just fyi - this was supposed to be 8 of each fish, turkey and chicken variety, but for the first time since I've been purchasing, the package contained 10 of the whitefish and 6 of the turkey -- instead of 8 each of these 2.  Very strange.  Don't know if it was a one-off or there were others."
5.0,fancy-feast-delights-cheddar-grilled,15.59,24,3.0,"My fur-baby, Harmony, loves the Fancy Feast Cheddar AND the Fancy Feast Creamy Delights. She cannot make the decision which she “fancies” the most. So, she gets both cause she’s worth it!
Plus the Purina food provides the upmost & trusted nutrition that I have depended on giving my pets for years."
5.0,fancy-feast-delights-cheddar-grilled,15.59,24,3.0,"One of these days, I will buy some cat food Phoebe likes for more than just once! If I could just buy the gravy, I might have more success! Phoebe can never say she doesn't get a wide variety of foods!"
4.0,fancy-feast-delights-cheddar-grilled,15.59,24,3.0,I started my cats eating sheba brand food and they wouldnt eat anything else.   Soon that wasn't good enough for them.  Very picky cats. I've thrown away so much food because they want eat it. Now I dont throw anything away anymore
5.0,fancy-feast-delights-cheddar-grilled,15.59,24,3.0,"my three cats always enjoy fancy feast. I often mix various fancy feasts. And sometimes it is difficult to make all three of them happy, but they don't like pate but everything they love."
5.0,fancy-feast-delights-cheddar-grilled,15.59,24,3.0,I have a real finicky kitty...and this seems to be one he will take the time to eat.  Thanks for the product and the ability to have it delivered to my door.
5.0,fancy-feast-delights-cheddar-grilled,15.59,24,3.0,"My cat loves this food. He stands in the kitchen with  me meowing until he's fed. Not because he's hungry, but because he eats this food up."
5.0,fancy-feast-delights-cheddar-grilled,15.59,24,3.0,My 15 yr old tiger really gobbles these meals up. She only gets a tablespoon per meal but she wastes no time in cleaning the bowl.
1.0,fancy-feast-delights-cheddar-grilled,15.59,24,3.0,I have 4 cats and none of them touch this food. Just one smell and they all walked away. Will  donate the rest to shelter and will not buy again.
4.0,fancy-feast-delights-cheddar-grilled,15.59,24,3.0,"I now have 3 cats and the 2 I have had the longest are VERY picky.  Fancy Feast is hands down their favorite.  They usually like seafood the best, but the Cheesy Delights are great for mixing it up a bit!!"
2.0,fancy-feast-delights-cheddar-grilled,15.59,24,3.0,"I thought cats like dairy product such as cheese. I guess I was wrong. All 3 of my cats turn their noses at this product. While the feral cats eat them, they tend to leave leftovers as well. Now if a starving cat not eating these; something not right."
5.0,fancy-feast-delights-cheddar-grilled,15.59,24,3.0,I have stopped trying to push dry food on them as they are all over 8 and one has a deformed mouth. I would rather they eat this than nothing. Also gives them moisture. Wish they shredded it a little better for older cats but they love it so mom is happy.
5.0,fancy-feast-delights-cheddar-grilled,15.59,24,3.0,My cats (all 4 of them) love this “new” variety. Cats are easily bored with their food so being able to give them something different is wonderful!
5.0,fancy-feast-delights-cheddar-grilled,15.59,24,3.0,Dexter loves the cheese in her food.  I love the ease of ordering w/chewy
5.0,fancy-feast-delights-cheddar-grilled,15.59,24,3.0,"My two cats, Mia and Lucy have to take salmon oil due to skin allergies and digestive issues, and they hate the taste of it on its own.  This is the only canned cat food brand that I can easily ""hide"" the salmon oil into where they don't turn their nose up at it, because there is so much gravy.  My kitties especially love the turkey and cheese variety."
5.0,fancy-feast-delights-cheddar-grilled,15.59,24,3.0,My cats tell me they love their new food. They eat the new meals with such gusto that it’s hard to miss how much they enjoy the new meal combinations.
5.0,fancy-feast-delights-cheddar-grilled,15.59,24,3.0,"FF is what I've been giving my 2 cats for a long time now.  Once they discovered the cheddar variety, that is what they prefer all the time."
