rating,name,price,num_cans,oz_per_can,review_text
5.0,royal-canin-veterinary-diet-urinary,49.39,24,5.8,"Poppie my orange cat, comes running when I pop open a can of Urinary SO in gel ! Thank goodness, as it has helped him to be healty and free of any urinary porblems these past 2 years. ."
4.0,royal-canin-veterinary-diet-urinary,49.39,24,5.8,I tried the morsels and my cat wouldn’t eat it....opened this product and my cat said this will work! Very happy he’a eating this.
4.0,royal-canin-veterinary-diet-urinary,49.39,24,5.8,"Badger is a 1 year old DSH cat and he ended up going to the vet due to me believing he was almost blocked or already blocked. Well I was lucky to catch it early and we got him on meds and prescription food to hopefully avoid surgery. My cat ate the wet food with no issues at all. He loves it, I'm in the process of getting him to eat the dry and the wet food now that we are in the clear. I wish it was cheaper but you got to do what's best for them if you care! Its definitely worth the money to keep him from getting blocked"
5.0,royal-canin-veterinary-diet-urinary,49.39,24,5.8,"After emergency surgery to treat a urinary blockage, my baby boy now has to be on this for the rest of his life. Great news is that urine re-check after 2 weeks on this diet and no crystals, and he loves it! Thank you Royal Canin!"
5.0,royal-canin-veterinary-diet-urinary,49.39,24,5.8,Sometimes you come home at the end of the day and realize as you’re about the feed your cats that there’s three cats of cat food left and you’re just too tired to go back out. I go to my Chewey account order what I need and it’s here in less than 48 hours. Saving me a trip to the store and saving my cats from the terrible fate of eating dry kibbles for 24 hours. Poor darlings!
5.0,royal-canin-veterinary-diet-urinary,49.39,24,5.8,"My cat loves this food! Usually he only likes ""kitty fast food"" but he now needs a special diet, I was so relieved when he ate the can in one gulp practically... with gusto!!"
3.0,royal-canin-veterinary-diet-urinary,49.39,24,5.8,1 cat will eat it the other has a hissy fit and hates it. He actually sprayed the wall when I didn't give in and change the food.
5.0,royal-canin-veterinary-diet-urinary,49.39,24,5.8,My cat would never eat canned food. Nothing but the same kind of dry food.  Then he had surgery for urinary tract stones and had to have wet food. Now he won't eat anything but Royal Canin SO.  He begs for it all day and night.
5.0,royal-canin-veterinary-diet-urinary,49.39,24,5.8,One of my cats has been on this product for many years for urinary problems in the past.  Since she has been on this product she hasn't had an further problems.
5.0,royal-canin-veterinary-diet-urinary,49.39,24,5.8,Pate is great for adding water so ur kitty gets extra wheb eating. I do a 1/4 can water down and dry food morning and night
4.0,royal-canin-veterinary-diet-urinary,49.39,24,5.8,"This is probably a good Rx food,but, my cat had an allergy to something in it, itched constantly."
5.0,royal-canin-veterinary-diet-urinary,49.39,24,5.8,"Trying to find quality food for middle and old age male cats, and have them like it has been a challenge. They eat this brand without hesitation."
1.0,royal-canin-veterinary-diet-urinary,49.39,24,5.8,"My cats ate this the first couple of times I gave it to them, but then they stopped eating it. Another wasted case!"
5.0,royal-canin-veterinary-diet-urinary,49.39,24,5.8,Cheaper then vet and more quantity! Alittle pricy but its still cheaper. We love it! Plus love that it comes to my house. Dont have to waste gas going to the vet and over paying for a lesser amount.
5.0,royal-canin-veterinary-diet-urinary,49.39,24,5.8,"After trying many different prescription foods for my cat, this one he loved. I often add warm water when it's been in the fridge."
5.0,royal-canin-veterinary-diet-urinary,49.39,24,5.8,I like this item because my cat loves it! Louie is very pickey. He recently had a urinary track infection. This food is wet and healthy for him and he loves it. Dry food was making him form a kidney stone and he kept throwing up! I ordered this and CHEWY was very sure I got this delivered. They are very attentive to their customers!
5.0,royal-canin-veterinary-diet-urinary,49.39,24,5.8,"Due to urinary blockages and last week a PU surgery, my kitty has to be on this food for life...and he loves it! The price point is good too. Very high water content so I never worry about him getting enough water. Highly recommend!"
5.0,royal-canin-veterinary-diet-urinary,49.39,24,5.8,"considering this is prescription food, I really loved that Chewy would contact the vet and made the process very easy! we got the delivery on time too, I am a Chewy Fan!"
5.0,royal-canin-veterinary-diet-urinary,49.39,24,5.8,"Our Vet recommended this, and it's doing the job.  Arrived quickly."
5.0,royal-canin-veterinary-diet-urinary,49.39,24,5.8,My cats eat this up! They love it and can't get enough.
5.0,royal-canin-veterinary-diet-urinary,49.39,24,5.8,My cat has urinary tract problems. I was worried about switching food and that he wouldn’t like it. He loves it and had no problem switching to this food. So far it helps his urinary tract issues.
5.0,royal-canin-veterinary-diet-urinary,49.39,24,5.8,My cat doesn't eat a lot of moist food.. This case is going to last a long time
5.0,royal-canin-veterinary-diet-urinary,49.39,24,5.8,My cats love this food. Great for male cats that have had past urinary issues
5.0,royal-canin-veterinary-diet-urinary,49.39,24,5.8,"My cat that is supposed to eat this food won't eat it.  However, some of my other cats will."
5.0,royal-canin-veterinary-diet-urinary,49.39,24,5.8,I have a cat that had recurring urinary tract problems until the vet put him on this. It's been about 10 years now with no recurrence.
3.0,royal-canin-veterinary-diet-urinary,49.39,24,5.8,I wind up giving most of it to my dogs.  The cats dont care for it.
5.0,royal-canin-veterinary-diet-urinary,49.39,24,5.8,"I struggled for about a year to get my little girl to eat the Science Diet C/D canned food. She hated it! I tried to make it more appealing by mixing in other foods, tuna water, anything I could think of, but she still would only eat small amounts and without much vigor. When I switched to the Royal Canin, it was like night and day. She scarfs this down like she'll never eat again. She asks to be fed. That never happened on the Science Diet. The C/D is pretty nasty looking. It's kind of chunky and crumbly, more like ground turkey or something, and even when adding water is still difficult to smash up. The Royal Canin is smooth and water can be added easily to make it into a nice little gruel"
5.0,royal-canin-veterinary-diet-urinary,49.39,24,5.8,"My cats have to have urinary so. This is one of the two flavors they make in the wet food. Fortunately my cats like this flavor, the other smaller can flavor and the dry food."
5.0,royal-canin-veterinary-diet-urinary,49.39,24,5.8,The cat began to eat the can food right away. He also liked the treat that we gave him. I like that the shipping was so fast.
5.0,royal-canin-veterinary-diet-urinary,49.39,24,5.8,"This is a prescription diet food. I had been giving my cats fresh fish for meals, which they loved. When I learned I needed to go to a urinary prescription diet I thought they would not be happy. In addition, this food is a cake type wet food that I thought would not be desirable. I found they love this food! I ordered the Hills Urinary prescription foods as well. They like this the best!!!"
5.0,royal-canin-veterinary-diet-urinary,49.39,24,5.8,"Easy, simple and fuss-free!  This is the only way to buy your pet food!"
4.0,royal-canin-veterinary-diet-urinary,49.39,24,5.8,I believe both foods are great choices however my two cats have gotten tired of CD and lack of variety (I do not use any fish products for either).  I asked my vet for other options and Royal Canin was one.  The both LOVE the flavor and consistency of the gel as opposed to the chunkier variety.
5.0,royal-canin-veterinary-diet-urinary,49.39,24,5.8,"My vet prescribed this recently for my two cats, and I was concerned since one is a picky eater, plus it only comes in larger cans and the cats only eat half in the morning and half at night - and they dislike refrigerated food.  But this stuff they both love, even right from the fridge!  And cheaper than getting from the vet"
5.0,royal-canin-veterinary-diet-urinary,49.39,24,5.8,"Our vet recommended this vet-formulated line for our 16-year-old cat with kidney problems. To our amazement and delight, her miserable symptoms completely stopped within a week, and she actually likes it! She has been on this formula (treats too) for a few months and appears healthy and happy as a clam at high tide. Plus Chewy.com has excellent service and speedy delivery. We are purring!"
5.0,royal-canin-veterinary-diet-urinary,49.39,24,5.8,"My cat has had multiple UT issues in his life. We switched over to this food as recommended and there have been no issues since (fingers crossed!). Great product, and Chewy delivers quick and on time."
5.0,royal-canin-veterinary-diet-urinary,49.39,24,5.8,So grateful to hopefully have no future urinary problems (fingers crossed) with our three boys.  The best part is that they luv the flavor of this food!
5.0,royal-canin-veterinary-diet-urinary,49.39,24,5.8,"A beloved and quite elderly cat of my acquaintance has kidney stones.  She and her momma are managing their existence with Royal Canin Urinary SO, and so far, all is well.  She is comfortable, and she also likes the taste of this food!  I'm happy because I can contribute to the wellbeing of a friend's cat with the assistance of the superlative product offerings and consummate customer service of CHEWY.COM, and all from the comfort of my computer desk.  Thanks!"
5.0,royal-canin-veterinary-diet-urinary,49.39,24,5.8,"You know cats one minute they love it, then the next week not.  So far he loves it. Seems to be working. He feels better already. That's the goal."
5.0,royal-canin-veterinary-diet-urinary,49.39,24,5.8,"My queen loves her food. I did biy the wrong consistancy but she is eating it...yhank Goodness
I should have ordered the morsels for the spoiled little girl...myfault"
5.0,royal-canin-veterinary-diet-urinary,49.39,24,5.8,Loved not having to go out in bad weather.  So easy to order.  No problem getting prescription diet for my cat.
5.0,royal-canin-veterinary-diet-urinary,49.39,24,5.8,LEEEEON is a fussy eater and I have fed him a variety of prescription foods for his problem with urinary crystals. He seems to enjoy this food because it is very soft and moist. Sometimes I do mix a little of his other prescription food with this and he likes that too.
5.0,royal-canin-veterinary-diet-urinary,49.39,24,5.8,"This is great for my special needs cat.  You and my vet are quick to approve this so there is no delay.  I am happy with all your services.  You are reliable and quick to ship. Thanks, Alice"
4.0,royal-canin-veterinary-diet-urinary,49.39,24,5.8,"My cat was recently put on prescription food for a urinary blockage. We tried all of the prescription foods out there, and this particular variety of this brand is the only one he will eat. Chewy had a better price than what I could get locally, but a number of the cans arrived dented - which is why I only gave it 4 stars."
5.0,royal-canin-veterinary-diet-urinary,49.39,24,5.8,This is a great product and an incredible price. I searched high and low for the best possible price because I’m disabled and on a limited budget chewy offered the best price by far. The product is also great because not only is it great for my 18 year cat with urinary crystals but it’s safe for her to take with her being diabetic. She also really enjoys the it!
5.0,royal-canin-veterinary-diet-urinary,49.39,24,5.8,"Usually a week is required to change to new food diet; however, little boy took right to this canned food first time it was served!"
5.0,royal-canin-veterinary-diet-urinary,49.39,24,5.8,"Last year, my male cat (3 years old at the time) had some very obvious problems urinating. He had a complete blockage and was close to death when I got him to the vet. 2 surgeries (he re-blocked) and $1300 later, the vet recommended Royal Canin Urinary SO. She sent us home with both wet and dry versions, so I mixed the two. I give him some dry food mixed with wet food and some extra water and he loves it. He's been on this specific diet for about a year now, and no blockage problems."
3.0,royal-canin-veterinary-diet-urinary,49.39,24,5.8,It's very hard to keep your animal happy especially when on a special diet.  I got this to try and give my cat a different option but he doesn't even want to be bothered with it . On another note my dog absolutely loves it ... lol
5.0,royal-canin-veterinary-diet-urinary,49.39,24,5.8,"One of my young cats had urinary issues suddenly a few weeks ago.  Our vet prescribed the Urinary SO.  He doesn’t love this food.  Much prefers the morsels.  But, he is currently eating about 8 oz of canned foods per day so I needed a more economical option than offered by my vet.   I was amazed at the speed of the delivery. Hoping to add the Urinary dry soon and I will get it from Chewy."
5.0,royal-canin-veterinary-diet-urinary,49.39,24,5.8,It's excellent and very reasonable price. And quick delivery
2.0,royal-canin-veterinary-diet-urinary,49.39,24,5.8,My cat doesn't like it. I thought I would try it for some variety. He will eat the morsles with gravy type but not the gel canned food.
5.0,royal-canin-veterinary-diet-urinary,49.39,24,5.8,"Discovered kidney stones when xraying for bowel issues. This food helped dissolve the type of stones he had. So, we now need to stay on this to keep any more at bay. I was feeding the chunk one, but decided to try this, since it is more like what he was used to prior. He took to it just fine. I alter between the two types now just to give him something different, since this only comes in one flavor. Wish they had other flavor options and a grain free option, as that is what we are used to feeding. Ordering is easy and delivered to my door fast! Packaging of products is great. No damage in delivery."
3.0,royal-canin-veterinary-diet-urinary,49.39,24,5.8,"My cat complains every time I feed him the canned food, but he was always a picky eater.  But he will eat it and if it prevents crystal agglomeration in his bladder, it will have done his job.  He does seem to like the dry food formulation of this product better."
5.0,royal-canin-veterinary-diet-urinary,49.39,24,5.8,I have a 1-year-old male cat who strains to urinate. This along with medication helps him.
5.0,royal-canin-veterinary-diet-urinary,49.39,24,5.8,"This food has worked extremely well to flush my cat's system after a UTI with bloody urine and struvite crystals. I mix 1/4 of a can with 2 Tbs of water and feed it to her 4X per day with the moderate calorie dry food as a snack. Her urinary output has increased 10 fold which gives me great confidence her bladder issues are being resolved. She is also more lively and playful, it's incredible."
5.0,royal-canin-veterinary-diet-urinary,49.39,24,5.8,"I was skeptical of ordering.this quantity the first time around bc my cat is finicky, and he had recently lost some weight. However, he really likes it and I'll be ordering again!"
5.0,royal-canin-veterinary-diet-urinary,49.39,24,5.8,"This has been great for our cat who has urinary tract issues. No issues since switch to this food, and he loves it!"
4.0,royal-canin-veterinary-diet-urinary,49.39,24,5.8,"Our several year-old male cat was eating standard kibble when he began suffering from crystals in his urine. We switched to RC Urinary SO, which brought relieve within 24 hours. Within three days, he returned completely to normal. In fact, he seemed more energetic. I wish the product was available in larger cans because he goes through almost two 5.8 oz cans per day."
5.0,royal-canin-veterinary-diet-urinary,49.39,24,5.8,"My kitten is 20 years old so when he started vomiting a lot and losing a lot of weight, I got nervous. I did some research and saw that they eat the dry food and it expands in their tummy and make them sick. Since we’ve switched to the can, he’s been doing great and putting on more weight!"
4.0,royal-canin-veterinary-diet-urinary,49.39,24,5.8,My cat recently had a complete urinary blockage. Our vet said to feed RC SO for life. So of course i ordered it from chewy. They had the best price! I gave it 4 stars because it would be better if they used better ingredients.
5.0,royal-canin-veterinary-diet-urinary,49.39,24,5.8,"My cat was on the Urinary SO in dry form but since having some teeth extracted, he is doing much better on the soft Gel canned food. My other cat loves it too."
2.0,royal-canin-veterinary-diet-urinary,49.39,24,5.8,My cat doesn’t really like it. Does it come in other flavors?
4.0,royal-canin-veterinary-diet-urinary,49.39,24,5.8,"My 10 year male cat has issues with urinary blockage, very limited with diet. He did not like the Royal Canin morsels in gravy but he likes this one.  I add a tablespoon of water and mix it.  I didn’t give it 5 stars as I wish the can was smaller.  It would be easier at feeding time as he only eats a little at a time and the cold leftovers are not as tasty for him."
5.0,royal-canin-veterinary-diet-urinary,49.39,24,5.8,My cat has been on this food for over three years now since he was diagnosed with interstitial cystitis recent purchase was processed quickly and arrived fast. He likes it better than the other options that were offered.  My recent order was processed quickly and I received all items that I ordered timely.
5.0,royal-canin-veterinary-diet-urinary,49.39,24,5.8,"Our cat developed the symptoms of FLUTD - obvious trouble peeing, blood in urine, and discomfort. Urinalysis revealed crystals in her urine. Our awesome vet recommended this as one of the best long term solutions. So far it's worked great! Our cat has not seemed to get tired of it yet and as long as she has a steady supply of it her urinary problems are nonexistant. Compared to continued vet bills this product is a steal!"
5.0,royal-canin-veterinary-diet-urinary,49.39,24,5.8,"Tater and Tot love this canned food so much, they beg for more!"
1.0,royal-canin-veterinary-diet-urinary,49.39,24,5.8,Only gave 1 star because my cat won't eat the wet version...he does eat the dry and likes it.
5.0,royal-canin-veterinary-diet-urinary,49.39,24,5.8,one of the best canned food for kitties with crystal problems!!!  only wish this exact formula came in a 3oz can instead of the 5oz can. but that comes from the royal canin (the company) ....but CHEWY rocks!! you are THE BEST!!!!!! will always order my kitty food from CHEWY!!!!!!!!!
5.0,hills-prescription-diet-cd-multicare,48.99,24,5.5,"When you place your first order, be sure to note the name and phone number of your vet if you don't have a copy of the prescription. Chewy will call the vet directly!                 
 I think after a while they'll learn to *love* it because this is the only wet food I will be putting out for them. Peter had surgery and he needs this food to help with his bladder issues. It came highly recommended by our vet. I can also let my other cat eat it to avoid any possible problems in the future.  They seem to really like it. So, we're all good.  They're also getting the prescription dry food to supplement the wet food."
1.0,hills-prescription-diet-cd-multicare,48.99,24,5.5,"My cat ate one bite of this food. From that point on, he would not touch it. He sniffs and backs away. On the ingredients label, I see things in it that I know cats don't eat. Unfortunately, I have half a tray (12 cans) left that I can't use (the other 12 cans I ended up throwing away after my cat would not eat it."
3.0,hills-prescription-diet-cd-multicare,48.99,24,5.5,"After an emergency visit and a 3 day stay at the hospital, my male cat who had a total urethra blockage was sent home with a prescription for this food and a few others to help eliminate the crystals he is making. I'm still not sure if he likes it. Cats can be finicky. I may have to try a different flavor or brand. Chewy was super easy to work with to get this prescription filled."
5.0,hills-prescription-diet-cd-multicare,48.99,24,5.5,"Our female cat was diagnosed with crystals, no stones but soon to follow. She took to it right away. My vet also approved it for my Male cat for prevention. He did not go for it at first but over a two week period he is now eating it. It is a pate but a very loose plate. It would be awesome if Hills started offering the CD foods in 3oz. cans. Overall positive"
5.0,hills-prescription-diet-cd-multicare,48.99,24,5.5,"My little orange and white boy had crystals in his bladder, doc put him on the ""stress"" version of this food but since he's 14lbs, I couldn't afford the smaller cans. Reading the reviews I was getting nervous that he wouldn't like the RX food... to my relief, he DOES! Actually, my other kitty loves it so much I've decided to just feed it to both of them-- makes it much easier. No more urinary problems and happy, well-fed kitties!"
5.0,hills-prescription-diet-cd-multicare,48.99,24,5.5,My cat with history of cystitis can only eat this food. My #2 cat loves it too so I feed it to both to prevent problems in each. Thank you Chewy for making it so easy to get this special food. And not have to lug it up flights of stairs
5.0,hills-prescription-diet-cd-multicare,48.99,24,5.5,I switched to this brand from Royal Canin urinary SO bc the RC only came in one flavor. My persian fur ball is enjoying this chicken flavor as well as the fish flavor and I find it easier to pour into his bowl since it’s mushier than the Royal Canin and I don’t have to chop the food up. If you need urinary care with a variety of flavors I recommend this.
5.0,hills-prescription-diet-cd-multicare,48.99,24,5.5,"Our big cat had 50 bladder stones, so now use this soft food and the C/D dry food. I use this soft food as a way to administer the laxative our big cat also needs. She suffers from a mega colon and, well, details are not pleasant. Even our other cat will eat this food; being a schizoid Siamese does not like soft foods."
2.0,hills-prescription-diet-cd-multicare,48.99,24,5.5,"I accidentally ordered the larger cans. Then thought..that’s ok..,  I will just use these up. The formula seems different. There aren’t as many chunks of wood look like vegetables etc. Neither one of my cats will eat this and my eight month old kitten eats just about anything !"
1.0,hills-prescription-diet-cd-multicare,48.99,24,5.5,"Was hoping the cat would like this because as far as I can tell, it is the only one in the 5.5 oz size and is considerably cheaper per ounce than the 2.9 oz cans.  But he hates it.  Will have almost nothing to do with it.  He loves the chicken stew and the tuna.  Not sure why they can't sell those in this size can and charge less.  Can't be that much difference in the cost of ingredients for them."
4.0,hills-prescription-diet-cd-multicare,48.99,24,5.5,"My cat needs it due to urinary problems.  I have to puree it as my cat is picky and doesn't like chunks.  But I think it is quality food and helps with his urinary problems.  In order to save money, companies are now making cans that dent very easily so about 1/2 the cans always come dented.  This is not a reflection on Chewy."
5.0,hills-prescription-diet-cd-multicare,48.99,24,5.5,It was a mistake. I meant to get the stew but so glad I got this. He loves it. I was wondering about how to send it back but decided to try it. I’m so glad I did. Thanks Chewy for all you do. We love Chewy!!
5.0,hills-prescription-diet-cd-multicare,48.99,24,5.5,"I am relieved that  you carry this item. Maggie, who has, up until now, been very fussy re food, likes the c/d. This is a relief as she has to have this kind of food. I am so very pleased with Chewy: what a blessing you are."
5.0,hills-prescription-diet-cd-multicare,48.99,24,5.5,"My 15 year old male kitty developed a UTI and the vet prescribed this food.  I was afraid he wouldn't like it.  Well, was I wrong.  He LOVES this cat food and is doing so much better.  Thanks for providing this wonderful food - and my kitty thanks you too!"
3.0,hills-prescription-diet-cd-multicare,48.99,24,5.5,I usually buy the small cd cans which I feed twice a day. So I purchased the large cans thinking I can get two meals from one can. My boy likes it as soon as it comes out the can but he won’t touch it for his second feeding.  I will go back to the small cans.
1.0,hills-prescription-diet-cd-multicare,48.99,24,5.5,I accidentally ordered this variety and in the larger can which was my mistake--the labels look identical on the website and are such a small picture that I didn't notice it was different than my usual order.  My cat does not seem to like it as much as the stew variety.
5.0,hills-prescription-diet-cd-multicare,48.99,24,5.5,"After spending 6 days at the hospital due to urinary blockage my kitty is finally home and slowly recovering. He likes it. So hope it will help to prevent any future blockage episodes, since it was very stressful and painful (still is) experience for kitty and very and traumatic moments for whole family."
